,site,date,stars,title,text,location
197,www.microsoft.com,2022-07-02T18:22:41.000Z,1,"The original Xbox and the NEW and Improved Series X- Xbox have the very same issues, It's never been addressed !","I purchased the original Xbox from Microsoft years ago but it was flawed with issues, It kept Freezing up and Crashing on me, Microsoft kept delaying the support so I was never able to have a working Xbox . It spent most of its time in travel to and from Support of which it was never correctly fixed. I gave that one away to a Nephew. Next I purchased the Xbox 360 when they came out thinking that issue would be fixed with the new and Improved Xbox 360. To my amazement,the New and Improved Xbox 360  did te very same thing as the old one, It kept crashing with different games and freezing up. I was told a wide variety of issues could be causing it like the games  I was playing were Corrupt  etc. I thought to myself, I'm done with Microsoft at that point so I gave that Console away and purchased a PlayStation . Oh Wow, I had the same issues with PlayStation as what I experienced with Xbox. It kept heating up even with a cooling fan I purchased. Why, Why, Why do I keep getting these Faulty Consoles. After  a few years, I got tired of that console and Microsoft Now was coming out with the very fast version of their Xbox series X,  so surely I thought they had fixed the issues that Plagued it for years. Some people never learn so I once again purchased another Microsoft Xbox, Now I am feeling so stupid and ashamed to have fallen for their tricks one more and again. Nothing is new with this new Xbox series X other than it loads faster  after Crashing and or Freezing up. I am so sick of these companies Stealing our Money  and not fixing the issues that have Plagued it for YEARS! That says everything right there  but a fool is born every minute they say and I guess I am proof in the pudding because I haven't learned my lesson yet,  I have to admit, I love playing video games when they actually work right, I would NOT, Let me repeat, I would NOT ever recommend anyone to ever purchase anything from Microsoft . They are deceitful and only are out to dig deeper into your wallet. Take it from this fool.They have gotten Thousands of my dollars and have yet to fix their equipment so it will play correctly!  I even filed a complaint with the Better Business Bureau which took me nowhere, Microsoft's answer to the complaint was someone would be getting in touch with me and investigate the issues I was having but no one ever did, The BBB contacted me and told me that Microsoft replied to them to close the case. They wouldn't mind the Negative review which would last for 3 years under their name so the BBB closed the case. They said they had nothing else they could do but to say the negative review would stay under their name for the next 3 years. Now I am yet stuck with another piece of Crap from Microsoft that freezes up and crashes continuously. Some games won't even play on this peace of Crap. my advice to anyone who wants to purchase anything from Microsoft is "" STAY CLEAR OR FACE THE HEAD ACHES / ARGUMENTS BEWILDERMENT AND FRUSTRATIONS!  =   You have been warned!  Even a support tech from XBOX  told me on the phone to get an attorney,I would need it.  PS If anyone knows of a Good Cooperate attorney in my area, I would appreciate the information. Thank you, I'm tired of fighting these people . I think they count on that ! My Xbox sits on the shelf unable to play some games to this date. It's left me weak and tired. Help!",US
198,www.microsoft.com,2021-07-22T13:47:52.000Z,1,Spam spam spam!,"Date of experience:   July 22, 2021",DK
199,www.microsoft.com,2021-12-30T06:11:54.000Z,1,Disappointing,"Date of experience:   December 30, 2021",US
200,www.microsoft.com,2020-10-27T14:00:02.000Z,1,Suddenly I can't log onto my OWN…,"Suddenly I can't log onto my OWN account starting with info@ Contacting customer service is VERY difficult with all the options you HAVE to go through!! Was told that I don't have a phone number attached to my office acount, but that was'nt true!! Dandomain.dk just helped me and it took 30 seconds.",DK
201,www.microsoft.com,2020-10-26T08:25:46.000Z,2,Please fix the bug and the Microsoft…,Please fix the bug and the Microsoft email.,US
202,www.microsoft.com,2020-10-17T13:24:23.000Z,1,Everything from Microsoft is malware,"Microsoft Office is ransomware by encrypting the files that you share with others. Try opening one of the files in notepad if you want to see how hard the encryption is. Skype made advertisement for illegal drugs right after being bought by Microsoft. Windows 7/8/10 is spyware. Windows 10 is self-installing adware. You can play most of your games without hassle on a Linux gaming distribution such as PopOS or Manjaro if you want to keep most of your game collection. Libre Office can break the encryption of Microsoft Office files, but it's best to share open formats such as odt or pdf.",SE
203,www.microsoft.com,2020-09-03T14:30:14.000Z,1,The worst costumer service you can…,"The worst costumer service you can imagine. And they steal your money. Dont trust these don't-care-about-costumers ""people""!!!",DK
204,www.microsoft.com,2020-08-28T05:09:42.000Z,1,Stuck in the 90's.,"Microsoft uses Windows to Harvest not just your info, but what ever is on your PC. They do this through their settings.  If you've ever wondered why you Update your PC then it screams at you to download something you choose to avoid? It's because you're not letting them harvest as much as they could from someone else.  Little to none of it actually goes to helping Windows, or a Customer who has a Problem with Windows. How do I know this? Their Customer Service is an Online Forum, which means ANYONE can respond to those issues. Some can even pretend to be employees, or lead you to believe they're employees by their user name.",US
205,www.microsoft.com,2020-08-13T08:50:28.000Z,5,I love Dynamics 365..,I love Dynamics 365... much better than salesforce,FR
206,www.microsoft.com,2020-08-06T22:19:10.000Z,4,Microsoft Support is really very good…,Microsoft Support is really very good quick response and quick support they really understand well about my problem and in just 15 min they solved my one drive problem,CA
207,www.microsoft.com,2020-08-14T00:32:58.000Z,1,4 Hours of my life lost to Microsoft Activations…,"END GAME - Finally after 5 days of ""we'll get back to you"" someone did - although lots of messages that ""we tried to ring you and left a detailed phone message on your answering machine"". TWO things there - 1) I don't HAVE any answering machine setup & 2) What time of the day were you ringing. I found out it was someone in the Central time area of the USA (I'm in Australia) - so I would have been asleep! RESULT - NONE!  ""Oh, I'm a software engineer, not activations - I can't help you. You'll need to talk to Billing and Activations"".  That's where I started nearly two weeks ago.  They have my money & give no after care to activate it. I will be returning the ""scratched"" card without an activation number back to the store I purchased it from using Australian Law to get over the fact Microsoft put on the card ""Not returnable once Activation covering is removed"".  It will become the software retailers problem - and if they waste 5 hours as well, they are welcome. I'm over it. There's alternatives that I will now pursue which aren't this ""Customer UNFOCUSED"". Disappointed at the arm waving and lack of knowledge by their ""support"" teams who haven't a ""link"" on their Support Help Desk Screens with what to do when this happens. EARLIER  4 Hours of my life lost to Microsoft ""Help Desk"" today that I'll never get back.  Microsoft Office 2019 Home / Business - purchased as a ""Card"" hanging on the hook at the local stationery supplier.  However the ""scratch the activation"" took off the number underneath as well. That started a whole bunch problems.   1) Whatever department you are transferred to is always ""the wrong department"". 2) When transferred to the ""right department"" you are disconnected mid-call.  Even though they have your call back number and email address, carefully taken from you at the start of the call, you are not called or emailed back. 3) Their notes from ""other customer support"" never seem to be available to another staff member. So you get yet ANOTHER ""Job Reference ID Number"". 4) Uploading documents to prove you purchased the said product brings a message from the Microsoft Secure Server ""Unable to upload - error"" - in a big red block. 5) Transferred again to another department. Go through most of the problem again. 6) Have to identify myself to them again with another email code number. Yet another Job Ticket generated. Seem to have me using a Macintosh with Windows software - really??? Details incorrect and requiring them to edit my name, email and phone number 7) Help Desk failed to make it work after 2 x 2 hour sessions. ""We'll call you back"". Estimated time is 3 to 5 DAYS (not hours). 8) It's YOUR activation code not working but I've been made to go through the hoops - repeatedly. Your support staff couldn't make their own support software (""We'll remote control your machine"" - fail.  You can upload your scans of your receipts please and the back of the ""scratch activation panel"" - Upload to Microsoft Secure Server - ERROR WHILST UPLOADING. However did get two bits (but the WRONG two bits) of information up to their secure server. 9) No better off with activating the software. 10) $345.00 out of pocket with ""perhaps"" a fix within 3 to 5 days.",AU
208,www.microsoft.com,2020-07-28T22:13:18.000Z,1,Awful support,"I had a technical problem on my Outlook, so I looked for help. The support did not manage to fix my problem but he managed to delete all my personal folders. Impossible to speak to a professional there. Apple does so much better!",GB
209,www.microsoft.com,2020-07-28T01:36:37.000Z,4,Microsoft’s Services Are Nice,"Microsoft’s Services Are Nice, But YOU RUINED MINECRAFT. Also I have an XBOX and I use it all the time I love the Xbox",US
210,www.microsoft.com,2020-07-14T15:51:18.000Z,5,Check out MS EVENTS well done Microsoft. …,"Not sure if this is correct company apologies if I am wrong. I would like to rate MS Events. These are one hour workshops for adults and children that are free of charge. What a fabulous thing to offer they cover training for many MS products from Office, Excel, Teams, PowerPoint and even coding and photography, although the latter is all sold out and I cannot join so please consider adding more photography events please. There is even an event covering using 365 with Dyslexia. Just fabulous for families who have kids at school who are struggling. Well done Microsoft five stars you deserve it thank you from me and my extended family who will all be using these courses. Keep it coming.",GB
211,www.microsoft.com,2020-07-11T16:54:26.000Z,1,7 days to discover they (for no reason) can not accept my payment,"Ok , go to MS store, buy the stuff the same way as always (the only difference was that this time wasnt digital). Pay the same way as always. Even call my bank if everything is ok. After ONE WEEK (in 21st century) they respond without explanation they can not accept my payment. Dont mention they dont bother to inform me how and when they want to delievery the package . And its about cz store, sorry Denmark, but cz store isnt listed.",CZ
212,www.microsoft.com,2020-06-14T11:57:26.000Z,1,Microsoft ruins user experience,Microsoft Updates are as usually absolutely use less. It seams as if they try to ruin the user experience with each update a little but more!!!,DE
213,www.microsoft.com,2020-05-29T12:05:10.000Z,1,i just had a near death experience with…,i just had a near death experience with microsoft teams this very bad app i am using for school and when i am talking to my friends my teacher can join any moment without a noise so i wont be able to hear him join that is very annnoying bcs i was talking trash about my teacher with my friends and now he is mad at me and is trying to give me bad grade and hitting me in school so in head and butt so thanks alot microsoft teems i hope you get this messege and will refund me with all the money i have used and also contaKT me teacher so i can ge my grades fixed AND i will defenently go to zoom now and  throw my microsfot PC out of da window' Have a great day i lov u all peace out actually 5 stars not....,DK
214,www.microsoft.com,2020-04-28T09:11:16.000Z,5,professional and personal at the same time,"I am living in Sweden, so the contact to Microsoft USA does not appear here. I use professional Office365 software and have frequently contact with Microsoft Customer Service. I would classify - based upon experience - Microsoft as having the best customer service in the world. It is the same engineer etc. that contacts me, if I dont answer they try again and their communication is professional and personal at the same time.",SE
215,www.microsoft.com,2020-04-10T21:29:29.000Z,5,I love Microsoft products,"I love Microsoft products, especially Microsoft Office, it helps me a lot in daily routine.",US
216,www.microsoft.com,2020-03-17T03:50:05.000Z,1,Dear Bill Gates,"Dear Bill Gates,  If you do not allow free internet for 3 months during this time, I will personally come see you.  Make it happen you billionaire!!! Heard nothing from you yet so get off your a.s and help these people out as you have made it mandatory to have the internet.  3 months free, everyone you rich bas.ard",CA
217,www.microsoft.com,2020-03-16T21:41:08.000Z,1,Microsoft u lost another customer,"I loved surface so much till I started having issues in the past 2 years. After my surface pro 3 broke they sent me a surface pro 4 that lately had lots of issues and been sent back , not to mention I paid twice since the warranty wore off due to be 3 months only! It just wore off and hardware issues! I had three surfaces pro 4 from repairs and all of them broke down to hardware issues!!! Now I cannot retrieve the broken surface , they want me to pay more. again! My money no more ! I don’t recommend surface to anyone just because of the issues that come after a few uses !!! I won’t be using anymore windows computers! That’s it!!! Hardware and software issues !",DK
218,www.microsoft.com,2020-02-07T18:01:48.000Z,5,I have been MS office 365 for the past…,I have been MS office 365 for the past two years. This helps me and my business organize things in a much better way. Thanks Microsoft for such a great product.,US
219,www.microsoft.com,2020-01-27T10:07:56.000Z,1,This is a Review for Microsoft Global.,"This is a Review for Microsoft Global. Issue: Surface Pro 4 - flickering, Flackern, scrambled Screen Payment	Financing Invoice	30 November 2016 Delivered	December 2016 (2nd Wk) Unboxed	24 December 2016 Setup		25 December 2016 Registered	25 December 2016 Office 365	25 December 2016 – 25 January 2018 Standard 	31 January 2018 (1 year) Warranty Extended 3-year Warranty for FREE REPLACEMENT PROGRAM should be	31 January 2020 (1 year + 2 years)  The official invoice of my device reads 30 November 2016. It was delivered around a week later. The device was unboxed on Dec 24 and I only started using the device from Dec 25 onwards. Setting up a new Win 10 device  requires one to use a microsoft account to login to the device and automatically registers the device for warranty.  In my microsoft account – Office 365 ended on 25 January 2018 (including first month free). Also on my microsoft account – device it states that 1-year standard warranty ended on 31 January 2018. Flickering on the bottom line started only around October 2019. My main computer was out for major repair in August/September 2019 and it was only then that the SP4 had to show its worth with music and video editing and  long PowerPoint presentations with integrated music and videos. I must say, the M3 handled the challenge really well, except fot the annoying flickering at the bottom  which disappears when the cursor was moved. In  the last week of December 2019, the device temperature was unusually high and the screen started scrambling. So, as long as the SP4 was just used for surfing, Word/Excel, and reading mails (during the warranty period), it was fine. When it was used for serious computing (after the warranty period), its HIDDEN MATERIAL AND DESIGN DEFECTS manifested themselves. Before the defects manifests itself, the client has no reason to research the web for solutions to the issue, and Microsoft, of course, does not voluntarily inform the client of this problem, although this had been known to them since End of 2015. Microsoft should have sent out a bulletin to all clients and should have recalled all sold devices.  I have contacted Microsoft Support. I was informed that based on Date of Invoice, my device was already out of the 3-year free replacement period and that it would cost me €640 fee for a replacement with a refurbished (REFURBISHED!) device of a higher model. But a HIDDEN DEFECT does not choose to manifest itself within their prescribed period.  And in my case, according to their own records, their warranty period only ended on 31 January 2018. My first contact with Microsoft Support was on 12 January 2020, which would be well within  the 3-year limit for the free replacement program.  A MATERIAL DEFECT remains a MATERIAL DEFECT no matter when it manifests itself. A device with a hidden Material/Design Defect has been defective from the beginning. Microsoft have themselves admitted that this is a hardware/material/design flaw, which affects a „small“ percentage of SP4 devices. Had they known beforehand, such a device, in hindsight, should not have been released for sale at all. The only solution is an outright full refund for the defective device. In My case, owing to the „tender loving care“ that the device had been given, the defect manifested itself at a much later time, giving very little time for the client to search through the forums for answers. For Microsoft to be practicing a rigid legalistic stance so as to pass the cost to unsuspecting consumers is simply a show of power being wielded by a tech-giant, when instead  they should be giving some leeway. On the other hand, Microsoft itself automatically extends, as a matter of principle, the warranty period of 1 year by 5-6 weeks from date of produkt registration. (25 December 2016 – 31 January 2018) So why not use the official Warranty Date? Why insist on the Date of Invoice? Between 30 November and 12 January are 42 Days! Completely in line with the 5-6 Weeks „grace period“ Microsoft itself considers standard and in their best practice. I wanted to return my device and purchase a new higher version of the surface pro series, without hidden defects. However, as a matter of rigid principle, Microsoft does not do such deals.  I have just purchased a brand new Surface Pro 7 for €949. This is €300 Euros more than what Microsoft wanted for a refurbished device with upgraded hardware – they actually don‘t tell you what you would be getting when you surrender your defective device. Microsoft Surface Pro 2-in-1 Tablet-PC are actually great products, if you don‘t happen to get a device with built-in Kinks. But Microsoft Client Support, considering the price for their high-end devices, is the worst I‘ve ever encountered.",DE
220,www.microsoft.com,2019-10-04T03:31:47.000Z,4,Good company,Good company. Nice products.,TR
221,www.microsoft.com,2019-09-02T08:26:04.000Z,1,£220 tax for fixing your PC.,"Microsoft have basically charged me a £220 tax for fixing my PC. My PC was gifted to me by my old employers, complete with a windows 7 install, which was upgraded to windows 10. My motherboard blew, so I had to replace it. As a consequence, Microsoft *require* a product key, which I don't have, because my PC was a gift. So a version of windows that was activated, no problems, is now toast, and Microsoft say I need to buy a new one! It's outright fraud!",GB
222,www.microsoft.com,2019-09-02T02:41:09.000Z,1,Microsoft assume you're mentally handicapped,"Microsoft assume you're mentally handicapped, and as such experienced users take a massive hit.",DK
223,www.microsoft.com,2019-08-11T10:31:53.000Z,5,The website is one of the largest…,The website is one of the largest business organization in world.,IN
224,www.microsoft.com,2019-07-09T16:10:43.000Z,3,I am very bad during use,"I am very bad during use, because my system always crashes.",HK
225,www.microsoft.com,2019-07-05T18:41:22.000Z,1,No Help,"Purchased Office Home & Student on May 23, 2019 and have not been able to install it.  Tech Support has tried twice and failed.  They said it was because of my slow internet service (DSL) Have not used the software of course and to date have not been able to have send a disc of USB  or credit my account.  I'm out $149.99 and am not a happy camper!!!",US
226,www.microsoft.com,2019-05-23T20:45:14.000Z,5,Support was quick to resolve my issue.,"I had an unfortunate experience with Microsoft Azure, however Microsoft support was quick to resolve the issue (within two hours) and that dwarfed the unfortunate experience by a mile.  I'll recommend Azure for that reason. Excellent and versatile service with effective and quick support. On a site note, I'll have to give another star to Microsoft for WSL, Typescript, VS Code and Windows Terminal. Thank you!",DK
227,www.microsoft.com,2019-05-21T10:44:42.000Z,1,My oæd email was hacked and thus…,My old email was hacked and thus Facebook too... Microsoft Denmark almost don't want to help.,DK
228,www.microsoft.com,2019-04-25T04:52:10.000Z,1,Windows Updates makes life HORRIBLE!,"Windows Updates makes life HORRIBLE! Microsoft should fire their current programmers who can't even code.   Thanks to the recent windows update in April - it broke my trading platform and I had wasted time re-installing it.  And that means loss of revenue for me. Microsoft - if this happens again, my next PC will run UBUNTU.",PH
229,www.microsoft.com,2019-04-13T10:21:36.000Z,1,Xbox games with gold is a scam,"Xbox live games with gold used to be worth 60$ a year.. about over a year ago Xbox games with gold made different terms to play the game, it used to be if you downloaded the game with gold and ran out of Xbox live gold membership you could still play the games you downloaded. but now that all changed, they made it so you can’t play ANY games you get for free with the Xbox live gold membership unless you redeem a new Xbox live gold member ship... I was never made aware of this basically scam till recently, I’m really considering switching to pure pc gaming.. console company’s are just scammers. And Microsoft is a joke that just wants money which is why they are trying to put their special Xbox game pass on PlayStation, PC, and even Nintendo!!!",CA
230,www.microsoft.com,2019-03-22T00:01:35.000Z,5,Love Microsoft!,"Date of experience:   March 22, 2019",US
231,www.microsoft.com,2019-03-21T22:38:20.000Z,1,Cannot count the amount of time and…,"Cannot count the amount of time and cost in euros I have spent fixing my computer after the unstoppable Windows 10 update destroyed works in progress, my fonts directory, competing browers installations, etc. This back door intrusiveness is in flagrant and criminal violation of the General Data Protection Act. Bless the EU for fining Google EU1.5bn for their criminal mischief. I only hope that they have the cajones to levy fines commensuerate with M$ criminal behaviour. I think EU10.0 would be a good starting point. What do you think?",GB
232,www.microsoft.com,2018-11-25T09:16:05.000Z,1,Det var da elendigt,Det var da elendigt. 800 kr om året? Not going to happen. Finder et bedre alternativ.,DK
233,www.microsoft.com,2018-11-22T16:40:53.000Z,2,Really annoying to use their email,"Really annoying to use their email.  You login and have to search and search for their email service.  I'll be switching to someone else.  I also find Microsoft a bit too big for their boots and am tired of how much control they have over your devices.  In the old days you'd buy a phone, put a SIM card in and were ready to go.  Now you have to sign your life over to Bill Gates.",GB
234,www.microsoft.com,2018-11-04T13:08:08.000Z,1,Bought a Surface Book 2 in Feb 2018.  Wish I hadnt!,"Bought a Surface Book 2 in Feb 2018.  The screen became faulty (screen ghosting where you see an image even after the window is closed).  8 agent chats/phone calls later they finally agree to replace.   The replacement arrives and is faulty.  Wont install windows updates.  Nothing installed and supposedly brand new machine so no reason why it wouldn't work.  Again, lots of agents trying to resolve.  Keep disconnecting from the chat when dealing with the issue so I have to start all over again and re explain to a new agent.  Rang up to say please collect the fault one and send me another.  Their response is that after 2 days of non stop hassle I have to send the faulty replacement  back, wait for a week and then try again to contact them to start the replacement process all over again.  Really bad service and I have wasted days on this issue.  I WOULD NOT RECOMMEND MICROSOFT UNLESS YOU ARE WILLING TO LOSE DAYS DEALING WITH MULTIPLE AGENTS REPEATING THE SAME TROUBLESHOOTING AGAIN AND AGAIN IN A FUTILE EFFORT TO AVOID REPLACING FAULTY GOODS",GB
235,www.microsoft.com,2018-10-16T06:48:20.000Z,4,The Surface Go is very close to an…,"The Surface Go is very close to an ideal budget tablet and mini laptop in one device, but short battery. Good!",US
