,site,date,stars,title,text,location
941,www.twitter.com,2019-08-30T23:15:41.000Z,1,Twitter -- We could not verify your credentials,"If Trustpilot had a negative Star Section I'd rate twitter ( -10 ) because they're one of the worst social networks for not responding to its Web Posting Media. I'm unable to find any information on how to Contact Twitter Directly. Apparently, Twitter is blocking my account with no chance for reactivation which has been blocked for whatever reason without given notice as to why. I don't recommend Twitter and it should be avoided unless you want to be writing here. The Issue: -- The email address used to file this request does not match the email on the account you mentioned. -- Sorry, that page doesn’t exist! -- We couldn't find that number. Please try again. are the responses from Twitter Contact Forms --  And there is ""No Number Contact or address"" that I can find. -------- Sending The Issue ---------- I need login and account support ------  I can't log in to my account or My account is hacked or compromised  ---------- Apparently, someone has High Jacked My account or compromised  my Twitter Account. I've tried servile times to Contact Twitter however, they keep send E-Mails telling my E-Mail does not match their Record and they can not find the number. Did I miss something in the word High Jacked or compromised? Here's what I further did. I went to Contact Us, selected ""I need login and account support,"" then ""My account is hacked or compromised,"" which took me to  ""Your Twitter username @"" in which I completed. Then: I have to enter in my email and a description of the issues I'm having. I also went there and used their Number Verification system. After that, here comes the email: ""Your email does not match our records and Number can not be found."" That sounds Hacked or compromised to me or their System is Screwed up royally.  How can you contact them Directly in a matter like this? I can not find another way. #twitter",US
942,www.twitter.com,2019-08-22T21:36:10.000Z,3,It's pretty good,"1. It's pretty good except for account's being locked all the time after they have been made because of ""automatic behavior"" when they weren't giving any ""automated behavior"". 2. You should let people make accounts like how they make accounts on ""DrawCast"", ""Google++"", and without emails that have been verified or made into gmail (or any other type of email accounts). 3. Suspend people who are bullying others. 4. Get rid of the block button. (I will edit this later)",US
943,www.twitter.com,2019-08-12T21:56:39.000Z,1,Toxic website full of troubled people…,Toxic website full of troubled people to sound like better than the other. Stay away from this one people. It's not worth it,CH
944,www.twitter.com,2019-08-10T17:48:20.000Z,1,Twitter Deactivated My Account.,"Had Been A Member Since 2015, Used Site Regularly  Since Then Suddenly The Açcount Is Deactivated By Twitter On 02/08/2019. - No Explanations.",GB
945,www.twitter.com,2019-08-10T17:41:45.000Z,1,Twitter Account Suspended After login - No Reasons Provided,"I signed up on twitter, no problems then when I tried to login again discovered the account had mysteriously been suspended. Have been told by others this is common practice for the twitter site",GB
946,www.twitter.com,2019-08-10T16:33:42.000Z,1,It is too easy to create a fake profile…,"It is too easy to create a fake profile on Twitter. You do not have to document that you are actually the person you want to create a profile for. But when you are trying to help a friend to remove an obvious impersonating, insulting, personally damaging, ugly fake profile which involves photos of a child minor of age the administration of Twitter demands an unreasonable amount of documentation. They do not accept national photo ID as the sole proof, They apparently do not look at or evaluate the presentation of the profile. They seem only to have an numeric interest in the number of users in the competition with other social medias....causing this way serious, damaging consecuenses to the life of the person who are suffering from the act of a bad person creating a fake profile in the name of another person publicing a false an negative image of this very same person. Come on, Twitter, You can do better than that. E.g. respect european laws AND in general your very own clients. It seems that Your company lacks a comon sense of ethics. Prove me wrong and I would be delighted to remove this coment and recomend your social media for the future. report 0123054766    [ ref:_00DA0K0A8._5004A1kU9nD:ref ]  Sincerely yours  Jakob B. Melbye, Denmark",DK
947,www.twitter.com,2019-08-09T13:09:21.000Z,1,THIS IS RIDICULOUS!!!!,"This is f****** ridiculous! In less than 24 hours my account was locked because of ""hateful conduct"" fine, appealed because I personally don't think it was but I'll just delete it if they ignore my appeal. Went to sleep and woke up to see that EVERY SINGLE TWEET OF MINE HAS BEEN REPORTED BY VIOLATING THE RULES. This time it's ""abuse/harassment. This is all because I had an argument with a troll who blocked me after insulting me first and closing off with insults and when I actually defended myself he was offended and now wants to play victim and Twitter are essentially letting him. He's spam reporting because he's still salty that I didn't back down and now he and they are punishing me for it. If anything HE'S the harrasser because he's reported every single comment, even the ones who had nothing abusive about it. How THE F*** is saying ""You poor thing"" and ""Anyone would be dumb to not check the system requirements"" abuse or harassment??!?!?! According to Twitter, you dare not tag anyone otherwise you are harassing them. I guess anytime you look at someone's profile, you are sexually abusing them. 🤦🏾‍♀️ This is DISGUSTING. Update: Now they just said they apologized for the ""error"" for ONE TWEET. The rest especially the ""Aww poor thing"" tweet is in serious breach of abuse or harassment. Someone is going trigger happy, they just ban and block left right and centre without a care in the world? Check more into the situation? Nah, just gonna press that button and continue eating. Ignorant buffoons. I already didn't like Twitter thus not using it often now I definitely won't, and if they just randomly delete my account out of the blue which I feel they will, I will praise the lord that I'm finally out of that cesspool of hypocrisy. I've had one troll that their entire account was dedicated to hating others, examples condescending and violent tweets about Black people, Muslims, Gay people, Women, Animals, and Disabled people. Their account was up for months without any action. Their YouTube also considered of hate videos of the above mentioned. Again, no action was taken. Only months later their account was locked or suspended after about 100 warnings. SERIOUSLY, F*** TWITTER.",GB
948,www.twitter.com,2019-08-08T11:26:42.000Z,4,Twitter is the best social media…,Twitter is the best social media platform for sharing both casual and formal information to family friends and business partners,KE
949,www.twitter.com,2019-08-07T10:34:10.000Z,1,Very hard to get hold of customer…,Very hard to get hold of customer support,GB
950,www.twitter.com,2019-07-31T16:04:02.000Z,5,I like using twitter and reading lots of tweets,I like using twitter and reading lots of the tweets. it has some news but i just read it to see what other people are into.it's like the pulse of people with piles of free time. I think most of the users are probably unemployed or housewives.,US
951,www.twitter.com,2019-07-29T14:34:09.000Z,1,Extremely terrible service,"Extremely terrible service. Your account will be locked for violating the terms of service when you didn't do anything wrong, but blatant transphobia gets a free pass.You will be left for days while they pretend a real person is reading your appeal, then instantly give you an automated response after a few days. Twitter is genuinely a nice idea as an app, but unfortunately the employees themselves are an embarrassment. Additionally, they ignore user feedback and despite being told that nobody likes the new layout, they force it on you anyway. My advice is to stay away from this app as it is genuinely one of the worst customer service I have ever experienced, and I've had to deal with EA's support.",GB
952,www.twitter.com,2019-07-28T10:47:11.000Z,1,"Rubbish app,wouldn’t ever use it again","Rubbish app,wouldn’t ever use it again!  Also love how a bunch of reviews i seen on here a few days back are suddenly gone?",GB
953,www.twitter.com,2019-07-24T16:13:13.000Z,1,The new layout is completely useless,"The new layout is completely useless, instead of listening to customers they've decided, once again, to redesign the whole thing and make things worse for everyone.  As a business owner the, now, lack of functionality and visibility is affecting my online presence.",GB
954,www.twitter.com,2019-07-24T06:40:40.000Z,1,Free speech is dead on twitter,The abusive behavior of some users is out of control. Twitter encourages the behavior unless you are a conservative then you aren't even permitted to say someone was being ugly without them dropping a suspension. I'm sure a class action lawsuit is on the way. Do not expect good service.,US
955,www.twitter.com,2019-07-22T20:49:26.000Z,1,Disappointed and Hurt,"Have reached out to support on every platform possible (Tweet, Message, Report, Phone) with a critical and personal issue and every time I am sent a link where I should upload an image to my case I get the error “you are not authorized to upload file to this case.” Support has not taken seriously the nature of this need. This is time sensitive and for over two weeks have yet to be reached out to by an actual person - whether by email or message - and they have been completely negligent to my case, regardless of the many attempts I have made to communicate this issue.  So, if you are interested in starting an account with a company with seemingly no one on the other end of the line, feel free to join up.",US
956,www.twitter.com,2019-07-20T17:33:18.000Z,5,Great,Great  Love it,GB
957,www.twitter.com,2019-07-20T12:55:56.000Z,1,I had been a member of Twitter for…,"I had been a member of Twitter for years and had suffered abuse before for my views. I had previously reported abusers to twitter but they refused to take action then I set up a petition and within 24 hours it had over 2000 signatures and i set up a link for this petition on my twitter page.The petition was on the Care2petition website. Care2petition emailed me to congratulate me and were giving me tips on how to promote my petition. It was also being promoted on their main website front page as a trending petition. Then all of a sudden my petition is removed and my twitter account is suspended. Both care2petition.com and twitter refuse to respond to my emails to ascertain the reasons for the suspension, i am now permanently suspended from twitter which i must say is like a breath of fresh air,no more endless abuse from the morons that frequent that platform. Both of these so called freedom of speech platforms are the opposite of what they are supposed to represent. I will no longer have anything to do with either companies , they only allow freedom of speech if it fits within their own political agenda. I recommend everybody remove themselves from Twitter, i can confirm you will feel a lot less frustrated and happier in your life and hopefully twitter will eventually collapse and disappear for ever.",GB
958,www.twitter.com,2019-07-20T10:09:25.000Z,1,Twitter has for months limited my…,"Twitter has for months limited my account after I prayed for a person who was cursing me out. After that, I was limited even further for asking a person to explain how they came about their facts. This most recent issue, twitter muted me for twelve hours saying that I said one of our Congressional leader's was acting like a bimbo after I caught them lying to the public. Bimbo is not hate speech.  Twitter is the new Nazi party. They allow people to send death theats and to verbally say that it is okay to kill people but to Twitter, praying for people and calling a liar a bimbo is too far apparently.",US
959,www.twitter.com,2019-07-19T17:24:12.000Z,1,One of the most bias sites out there,"One of the most bias sites out there.  They've allowed libs after multiple warnings from many of us about stalkers, hackers impersonating and breaking into our accounts, doxing us.  Twitter in their ultimate wisdom chose to ignore those complaints and ban all of us for life for reporting a liberal troll with 100's of accounts.  I have all the screen shots and complaints made to twitter with their usual excuse ""context maters.""  Well saying ""you are going to post my IP and names and locations of my family""  seems like there is only one context to take.  Not twitter they said it was ok.  But reporting him was evil.  Go to Gab and use it.",US
960,www.twitter.com,2019-07-18T10:08:12.000Z,5,Up to date personal news,"One of the current apps that is always moving in the right direction, only thing I would like to see changed is the £50 minimum promotion fee even though they advertise its $10 or $20!",MK
961,www.twitter.com,2019-07-16T20:32:45.000Z,5,One of the current apps that is always…,"One of the current apps that is always moving in the right direction, only thing I would like to see changed is the £50 minimum promotion fee even though they advertise its $10 or $20!",GB
962,www.twitter.com,2019-07-11T06:51:03.000Z,1,Twitter is run by horrible people,"Twitter is run by Fascist losers with zero understanding of how to run a social media platform. I cannot wait for Twitter to disappear off the face of the Earth ala MySpace. Twitter's true motto is: Protecting child molesters, fascists, white supremacists & other evil people at the expense of common man. Disgusting at best",US
963,www.twitter.com,2019-07-09T21:18:43.000Z,1,Twitter is now a leftist outlet working…,"Twitter is now a leftist outlet working to silence conservative ideals and philosophy.  They allow the leftists to employ profanity and threats while a simple contradictory comment from a conservative gets them suspended.  The have a leftist agenda, censoring those who speak out against it.",US
964,www.twitter.com,2019-07-06T00:58:48.000Z,1,Zuckerburg's arbitrary and capricious political suspensions.,"It's been two weeks now since the ""keepers"" of Twitter website suspended my Twitter account, accusing me of ""multiple violations"" of the ""Twitter rules"".  My Twitter account was at least 4 years old and I almost daily used it to express my political progressive leanings, including: criticizing Donald Trump, the Republican Party and several of Trump's minions; criticizing Israel's long standing brutality and racism enforced by its ""Israel Defense Forces"" and imposed on its ""neighbors"", the Palestinians; and criticizing the ""leadership"" of the Democratic Party.  I have repeatedly filed appeals to learn specifically why my account was suspended.  No response to date from Twitter. Consequently I obviously am the victim of Mark Zuckerburg's politics and his Twitter website which fails to specify which of its rules was ""violated"" and how and why any of my tweets ""violated"" the Twitter rules.  Absent much-needed regulation of Zuckerburg and his Twitter website, I must conclude that I surely am not alone as a victim of Zuckerburg's arbitrary and capricious political suspensions!",US
965,www.twitter.com,2019-07-02T06:28:19.000Z,1,"Shadowbanning, no free speech","Blocking conservative accounts are just hypocritical on Twitter's end. It's not Twitter, it's TwitLer.",IN
966,www.twitter.com,2019-06-26T05:34:17.000Z,4,Wow... didn't expect so much hatred for Twitter!,"Wow, didn't really expect so many bad reviews for Twitter! They aren't too bad I don't think. I mean they aren't in my top list of social media apps to use but didn't expect them to have a 1 star on here! Well hopefully this 4 star helps them out some because God knows they need it.",US
967,www.twitter.com,2019-06-24T11:08:50.000Z,3,Twitter is decent at best,"Twitter is decent at best, I certainly do prefer to use Twitter over Facebook, but there are many issues that Twitter has, first of all the fact that they gave their website a very bad new design, and second which in my opinion is the biggest one so far is that you can't state your opinion without some toxic radical SJW coming out of nowhere to shame you for it. Basically, if you're looking for a really chill social media platform, Twitter is certainly not for you, well unless you manage to keep yourself away from those creeps. But in general, Twitter is decent.",GE
968,www.twitter.com,2019-06-22T15:43:50.000Z,1,Liberal Bias Twitter,Biggest pile of pathetic bias liberal garbage. The 1st amendment only applies to libturds.,US
969,www.twitter.com,2019-06-17T17:00:52.000Z,1,Twitter's stupidity has never failed to amaze me.,"Out of curiosity I signed into my Twitter account and guess what?......... Yep, they suspended me again after recently unsuspending me (for the third time) with new allegations this on this occasion of ""trying to evade a suspension."" How can I be trying to evade a suspension when it was the ""notrights"" in Twitter-world who unsuspended me? Confused? Yes, so am I.  You would think that with staff as stupid as this in Twitter then the Company would implode on itself. Yes Twitter, you still only deserve one star, and that's for your stupidity!",GB
970,www.twitter.com,2019-06-16T20:27:51.000Z,4,I really love the company,"I really love the company, it's absolutely fantastic firm with a lot of things everyone can use in their daily entertainment for everything else to be good. How do you really want them to better? Who are all this people with bad reviews ? Twitter better than FB anyway.",RU
971,www.twitter.com,2019-06-15T10:13:29.000Z,4,tweet tweet,i like a controversial tweet sometimes twice on Sundays,GB
972,www.twitter.com,2019-06-11T16:32:09.000Z,2,Censor capital,"How can you consider a young adult dressed in a military outfit offensive? Are you actually joking and this is a well elaborate troll or is it just plain stupidity, twitter?",DE
973,www.twitter.com,2019-06-11T04:34:59.000Z,4,Twitter has its pros and cons and it…,"Twitter has its pros and cons and it reflects a lot the modern society. On Twitter you are allowed to be yourself or whoever you want to be behind a user, that being said it's easy to find violent people spreading hate on this platform, using it to simply put others down. However, being anonymous allows a lot of people to express their selves freely and harmlessly, which is a mega positive point.  I've read some reviews on the political side of Twitter saying that it is strongly right-winged oriented, honestly, you get what you search for. The site is neither a right or left wing box, it is simply a box and looking through it you will find things you want and hate. A few problems with the Twitter algorithm suspending accounts randomly for no apparent reason is quite odd and that reason I took 1 star off this review. There is no clear communication! Sometimes you may have just started a new account and... BAM! It is suspended by no reason and you can't get it back. That truly needs some work.",BR
974,www.twitter.com,2019-06-10T14:35:07.000Z,1,Very politically motivated.,Very politically motivated. left wing rubbish. endorse fake news.,GB
975,www.twitter.com,2019-06-05T18:36:16.000Z,1,I read and saw posts from others,"I read and saw posts from others. I responded initially to some posts in a cordial respectful manner. Some responded back immediately with vulgar comments. They started the ball rolling. So I replied back to the vulgar responses in the same manner. I got a notice of twitter account suspension from what I replied to. I did so in the way some others had started first. If that is twitter's solution, OK. I just made me realize how useless twitter really is and deleted it from my phone. Good thing is I feel better for doing it.",CA
976,www.twitter.com,2019-06-04T16:46:14.000Z,2,eh..,not important or anything...,US
977,www.twitter.com,2019-06-03T14:16:25.000Z,1,Unfair and bad business practices; Twitter is not meant for brands and startups,"I have a branded account for my business, and Twitter decided to suspend my account. Not to mention I have a trademark on my brand, licensing, etc to run my platform. Twitter does not investigate FALSE claims and they do not give you to have a FAIR chance to dispute anything (even if it was their mistake). It's basically a lose-lose situation because once it's done, it's done. Their automated process for re-investigating/counterclaims are just bogus - it's all automated OR they just refuse to take the time to investigate their mistakes. Twitter, you need to make some serious steps to helping and protecting business owners and branded accounts b/c competitors are putting in FALSE claims and you are not investigating them properly. Give people a fair chance to solve any issues instead of shutting down their account and ruining their brand.",US
978,www.twitter.com,2019-05-21T01:45:59.000Z,1,HUGE COMPLAINT AGAINST TWITTER,"Like all others who have complained about Twitters ongoing “Suspension” activity against Twitter accounts, I too am a victim of my Twitter account being wrongfully “suspended” for playing the “Follow For A Follow”, “Follow all those who ‘Retweet’ and ‘Like’ “ Posts. I did NOTHING to deserve this treatment by Twitter. I had nothing but GOOD INTENTIONS with my Twitter account. I had over 48,000 Followers over a 10-year period and now “0”! Their CUSTOMER SERVICE SUCKS!! I do not recommend Twitter to new accounts. They can screw with your account too!",US
979,www.twitter.com,2019-05-19T23:30:10.000Z,5,Twitter Is Just Great!,"I like using Twitter because I am able to tweet out, retweet my own and other people's tweets, like tweets, add/remove a cover photo and do much more. What's not to love? I recommend this social media platform.",GB
980,www.twitter.com,2019-05-16T06:49:49.000Z,2,got suspended for doing nothing,"so i created an account i did not set a profile picture or an offensive username i didnt tweet or even follow anyone i pretty much didnt really use my new account came back weeks later.. to find it suspended! i contacted support saying i had no idea why in the world i was even suspended and they unsuspended my account now.. what kind of service suspends you for NO reason, if there was a reason im sure they'd told me, but the fact that they accepted my message about not knowing why i was even suspended.. i think that says alot",SE
981,www.twitter.com,2019-05-14T22:33:11.000Z,5,I have been on Twitter for a long time,"I have been on Twitter for a long time. I had some issues with some users like stalkers, but overall I enjoy posting my photos, works, and videos on here. I have not posted my works that much lately because I have been so busy with school and other commitments. However, I will be posting more content now and in the future.  I would recommend everyone to use this website, but be careful what you post on the website though. I also advise everyone to put your copyright information so no one can steal your content.",US
982,www.twitter.com,2019-05-14T11:39:30.000Z,2,Depressing,"You'd think with how ""big"" twitter is, they wouldn't just be another puppet company that only caters to @sskissers that spread the news TWITTER wants you to read. #RealNewsGetCensored",GB
983,www.twitter.com,2019-05-13T15:19:04.000Z,1,Banning Conservatives viewpoints,Banning Conservatives viewpoints. Shutting down free speech because they don't agree with it their ideology. Safe space for Fascists. They are dying & I don't even care. #VeryFakeNews Smear Merchants.Communist Propaganda.,MM
984,www.twitter.com,2019-05-12T08:27:54.000Z,1,This company is a cesspit.,"Date of experience:   May 12, 2019",GB
985,www.twitter.com,2019-05-10T13:48:31.000Z,2,It almost seems pointless to write this…,"It almost seems pointless to write this review, because so many other people are clearly feeling frustrated with twitter. Considering so many people are on twitter, it has become a company with no real competitors for short-form communication. Twitter has so much influence on people and politics around the world, perhaps even more than Facebook, considering that Twitter is the chosen platform for most journalists and politicians. It's dangerously powerful at limiting speech and banning people.  I think we are at a stage where the US government should get involved and ensure freedom of speech is protected, otherwise twitter and facebook can remove dissenting and critical voices and control the political debate of all nations, in which it operates.",GB
986,www.twitter.com,2019-05-08T17:51:40.000Z,1,Left wing bias and a complicated mine…,Left wing bias and a complicated mine field of political correctness.  A very difficult site to use for any right leaning person or conservative.,GB
987,www.twitter.com,2019-05-08T11:45:26.000Z,1,Twitter is despicable in the way that…,Twitter is despicable in the way that it allows those leaning left to lie and make false claims as in Carl Benjamin's case! He's not even able to refute any claims towards him. This is not fair.,GB
988,www.twitter.com,2019-05-08T11:08:40.000Z,2,Politically motivated censorship by the…,Politically motivated censorship by the organization leads to a silencing of voices of legitimate people.,US
989,www.twitter.com,2019-05-08T10:37:13.000Z,1,Left-wing fascist controlled…,Left-wing fascist controlled organisation. What more can you say really?,GB
