,site,date,stars,title,text,location
102,www.microsoft.com,2021-10-27T05:48:46.000Z,2,Not great,"Not great my friend has a Lenovo laptop which is really weak for gaming and my laptop is decent for gaming, but he got Windows 11 before I did, he got Windows 11  and after 6 to 7 months then I got my Windows 11 wow Microsoft wow.",AE
103,www.microsoft.com,2022-03-17T20:57:51.000Z,1,What a terrible website,"What a terrible website. Easy to buy items from its store, but when it comes to refunds, what a rigmarole. I have been trying for days to get a refund for a piece of software I purchased through its MS store, which didn't even work and everyone has the right to change their mind, and it's just the runaround on a hamster wheel. It's so frustrating. Microsoft tells me to contact the third party, and the third party tells me to contact MS store support, but there is zero support. Order number 8645544735 for something called Stellar Support for Word, which didn't fix my files, and they have not provided the refund, but tell me to contact MS Store support. Very frustrating. Avoid at all costs. That is free advice.",GB
104,www.microsoft.com,2022-07-03T20:21:30.000Z,1,Care more about money than customer happiness,"Forces you to ""finish"" setup of windows (on a 7 year old pc) and does not let you skip. Gives you ads for their office package along the way, forcing their **** down your throat.",DK
105,www.microsoft.com,2022-12-06T18:56:14.000Z,1,The security on the Microsoft Xbox - Minecraft account…,"The security on the Microsoft account is absolutely appalling. Children can hack in with ease. Identity theft is common. It is now so bad that you can actually wonder that Microsoft are in cahoots with the criminals! Or perhaps they are the criminals! Once you have been hacked you lose everything. Microsoft are too ineffective to recover and they won’t pay a refund on any thing you buy such as Minecraft. How these accounts are hacked is a mystery but the hackers easily circumvent any safeguards. Their support team could not turn on a tv yet alone a computer. But rogue elements in Microsoft may well be accessing accounts. Certainly they will need insider information to crack codes and change emails. Microsoft has The worse costumer service in history! Go google or apple this company are atrocious and dangerous for children on Xbox etc. stop hacking !! Write to Microsoft. My child was playing Minecraft when out of the blue his Microsoft account was hacked and he lost control of his Minecraft. After this we got another account and saw his avatar being used by a user who was pretending to be a kid, then talking to kids on the game. Totally unverified user among kids!! Contacted Microsoft who were completely unconcerned! Beware people that is  how dangerous Xbox and other microsoft games are!! The fact is  Microsoft know there are dangerous people in theses games. We witnessed how it is done And how Microsoft do NOTHING!",GB
106,www.microsoft.com,2022-10-21T03:28:36.000Z,1,I had terrible experience with…,I had terrible experience with microsoft support they dont help restore my account email was hack and somebody else is use it,SE
107,www.microsoft.com,2022-04-29T17:29:02.000Z,5,Quality software,"Quality software, no adverts, good on privacy. From other Trust Pilot reviews I notice the problems consumers have are because of their high bar when it comes to security and privacy.",GB
108,www.microsoft.com,2022-07-13T19:16:53.000Z,5,I have been using their services from…,I have been using their services from past 15 Years. It has been a great experience and i am expecting that it will grow more in future. Thanks for your contribution.,PK
109,www.microsoft.com,2021-02-27T20:01:22.000Z,1,Never buy your laptop in the Microsoft Store,"The 30 november 2020 I bought a Surface laptop 3. After having worked on the laptop for a while I realized that the space bar didn't work properly. It took a while before I realized that it actually wasn´t working- because it sometimes work - sometimes not, and then I find my text without spaces. I have tried to complain to Microsoft where I bought the laptop, but they will not repair the laptop, they only offer me a used - refurbished laptop and that is absolutely not a ok way of solving the problem, when they  actually sold a error encumbered item. According to our danish law we have as a buyer of af new product the right to an repair of the laptop, or Microsoft have to exchange it for a new one.",DK
110,www.microsoft.com,2022-01-08T07:51:38.000Z,2,Windows 11 is awful,"Windows 11 is awful. It looks great, until the window (no pun intended) of opportunity closes in 10 days to revert back to Windows 10. So glitchy.  The photo editor program used to be extremely helpful and easy to use. I often used  it to augment my other photo editing programs. The great filters are gone now, replaced with junk. No more sliders.  The clarity/sharpening slider is gone. The EXCELLENT Spot fixer is gone. That is the worst ""upgrade."" Instead of making this program better, somehow Microsoft found a way to make it WORSE. I swear they spoke to Shutterfly about how to ""upgrade,"" and make customers more frustrated with photo editing software.   No one seems to know how to download the Windows 10 photo editor. Seems like that should be a simple thing to do.",US
111,www.microsoft.com,2022-09-17T18:07:25.000Z,1,even on hibernate they forced wake up…,"even on hibernate they forced wake up and updated product closed my working programs, just let me postpone my update to not ruin the job",DK
112,www.microsoft.com,2021-01-05T15:35:13.000Z,1,Windows updates has rendered my MINIX…,"Windows updates has rendered my MINIX computer from 2018 useless, and filled up the harddisk so it cannot be reset. Microsoft support hung up the phone on me. I guess they could'nt solve the issue either.",DK
113,www.microsoft.com,2021-10-05T14:14:59.000Z,1,Just when you thought they couldn't get…,"Just when you thought they couldn't get any worse...i have a gaming PC that runs games on ultra/high and windows 10 all fine yet apparently it cant run windows 11? whats with all these stupid requirements? its clear they want everyone to go out buying new computers and parts etc or why throw in these requirements? have to have updated CPU's and this TPM bs for an operating system? why has this never been a thing for previous versions? windows 11 looks cool but im not going out buying a CPU that you class as supported when i have a perfectly working gaming PC. The response is ""oh but windows 10 is okay and we'll continue updating it for like 3 year"" wow thanks...dont you realise people hate windows 10? might just go back to windows 7 the only OS actually good.",GB
114,www.microsoft.com,2020-11-06T07:34:19.000Z,1,CIA and NSA prostitutes,these LGBT lovers think they have the right to turn my PC on remotely and run their crappy UPDATES during the NIGHT! And leave my pc on the whole night!!!! I hope microsoft goes bankrupt CIA prostitutes.,RU
115,www.microsoft.com,2022-08-05T04:18:58.000Z,1,if i could rate this company 0 stars i…,"if i could rate this company 0 stars i would. I HAVE REASON TO BELIEVE THIS COMPANY HAS HACKERS. it has been 3 years since my microsoft account has been hacked and i apparently have an ongoing subscription with this hacked account... i am making this ZERO STARS REVIEW in hopes that someone could get back to me to help me out. i only want to regain access to my email account so i could cancel that stupid 123.17$ ongoing charge they are STILL charging me for every year... only days after making this new email account (3 years ago), i was hacked coincidentally after starting a trial subscription that i now obviously cannot cancel since i have no access to my own account. i have no problem taking this matter further. i have attempted everything. and now still 3 years later i am still being charged for something i have no access to. this is unjust. there is no way anyone from this company could help me regain access to my account.",CA
116,www.microsoft.com,2022-12-27T11:38:35.000Z,1,This company is absolute dog poo,"Date of experience:   December 27, 2022",GB
117,www.microsoft.com,2022-07-08T20:57:52.000Z,1,Since January I have been trying to…,Since January I have been trying to sort out why my licenses for Visio and project have disappeared from my account. I managed to speak to one lady in the uk who was very good but bemused that she couldn’t find any details at all although she could confirm I had a licensed product. I have also been in communication with the USA who are as useful as a chocolate teapot. Every time they call me they try and put me through to someone else and after 30 mins the call dies. Asks the agent can this team not call me. Answer they can’t till you log an incident with them.  How many friggin tickets do you need to log to get to the right friggin team for the grade of god. In fact I think I have a better chance of getting an answer from god than Microsoft’s technical team or billing and accounts.  All I need Microsoft is my license key and where to download it.  I am not the only person this has happened to.  Got a friggin grip.,GB
118,www.microsoft.com,2022-09-30T17:48:47.000Z,1,The worst thing i ever seen,"The worst thing i ever seen, i downloadet minecraft to times and its still not Working because Microsoft family settings",DK
119,www.microsoft.com,2021-02-26T13:28:29.000Z,1,What is going on???,"What is going on??? I contacted you the first time monday, where you tried to help me and said that a person from data protection should contact me. Tuesday I phoned again since I didn't hear anything from you! Then I was told 1-3 days is the expected timeline to get it solved. Wednesday then the 3 days were over I phoned again and suddenly the timeline was 3-5 days, but she expected that I would be contacted within 24 hours! Thursday I didn't bother to call you again. Now we have Friday and you haven't called me and I called again earlier and got the same 24 hours answer!  Please fix our account, we need access to our mail in order to do our work. We are missing out on a lot of sales when we don't have access to the email! Who are going to cover this? Contact med ASAP!!! Regards Thomas",DK
120,www.microsoft.com,2020-11-03T17:47:18.000Z,1,If you make an update at least make it…,If you make an update at least make it work My first screen of pc is not recognized any more hours of work lost I send my bill to Microsoft you should be ashamed!!! Its time for Ubuntu,BE
121,www.microsoft.com,2022-06-24T02:06:38.000Z,1,They took over 600$ when I purchased…,They took over 600$ when I purchased surface pro 7 bundle never received my laptop only cover case for laptop never will I buy again from Microsoft,US
122,www.microsoft.com,2022-03-30T20:36:04.000Z,1,Worst customer experience and support on Earth,"I would give them minus 10000000 but there is no such option! Worst customer support on the planet - robots can not solve all issues!!! If you have other options never ever buy from them!! They just charge your account and then leave without any options to get support and a refund that they told me I could get after canceling the subscription - tried everything - created a support ticket (after spending some good time finding this option because all is done in a way so people give up and even don't try to get to the support), submitted my phone nr for a callback (again after spending some time to get so far), after two days without any responses from them called support by myself (waited on the lane for around 10 minutes by listening to their robot, sure, why we need a human if there is a robot) - no success to get to talk with a human and get my money back for a service that I DO NOT USE!",LV
123,www.microsoft.com,2022-05-08T08:29:17.000Z,1,Word is the worst,Word is the worst. Setting the proofing language is an absolute nightmare. You shouldn't need to spend an hour trying to switch from French to English.,CH
124,www.microsoft.com,2022-10-30T16:07:05.000Z,1,how can the biggest software company…,how can the biggest software company make such bad software? lost everything in my word document.,NL
125,www.microsoft.com,2022-05-23T18:26:39.000Z,1,The worst is the word,The worst is the word. Setting up the proofing language is a complete pain. You shouldn't have to waste an hour switching from French to English.,US
126,www.microsoft.com,2022-02-12T11:22:57.000Z,1,Bought a laptop with Windows 10,"Bought a laptop with Windows 10 - I find it utterly dreadful - the browser is covered in links for services I do not want - Previous experience with 8 and 10 have been bad - fault after fault - continually struggling to keep it running. I am told they use your bandwidth update other peoples computers too? - 98, 2000 and even XP were good and reasonably stable - I will now be using Linux Mint instead - It has been stable and non intrusive for years on another laptop - it's everything Windows used to be and more - no paying for Office - Open Office is free. Linux is stable. I have another laptop I will now always delete windows without even bothering to start it - I keep an old laptop for running the odd piece of windows software until i can install a windows emulator like WINE. I used to like Windows for it's non intrusive platform - they seem to have lost their way somewhat - no more for me.",GB
127,www.microsoft.com,2021-12-28T07:19:33.000Z,5,Grade A,Microsoft is really great because they are the cutting edge of business enterprise software and even better now that it's all intertraded with Google.,US
128,www.microsoft.com,2021-07-26T02:17:17.000Z,3,not as good as I expected,"not as good as I expected , server 2019 is too expensive on this official website , luckily I get a cheaper one on keyingo.com, it saves me a lot of money !",US
129,www.microsoft.com,2022-03-14T21:35:20.000Z,4,The windows it's not what it was…,"The windows it's not what it was before, a lot of things that makes your machine running slow.  I don't need gps location and all kind of gigs!",US
130,www.microsoft.com,2022-09-13T05:43:16.000Z,5,can't imaging life without microsoft…,can't imaging life without microsoft they deserve a 5 star for having all the things for us thank you bill gates,US
131,www.microsoft.com,2022-09-25T02:38:14.000Z,1,JUST delete my files with no…,JUST delete my files with no reason=Microsoft most of my files in windows deleted by microsoft thanks:(:(,GB
132,www.microsoft.com,2022-05-09T08:13:43.000Z,1,The worse unreliable system ever,The worse unreliable system ever. Updates take over your computer for an hour and then the system is even more unreliable. Total crap,GB
133,www.microsoft.com,2022-06-22T16:58:03.000Z,5,Beside using windows my entire life,"Beside using windows my entire life, I like Microsoft's keyboard they very good suitable for my needs and almost never go bad.",SC
134,www.microsoft.com,2022-08-31T00:44:35.000Z,1,Microsoft customer service keeps…,"Microsoft customer service keeps ignoring my issue and refuse to help, they even start ignoring at some point.",CA
135,www.microsoft.com,2022-06-21T15:24:35.000Z,5,I love their customer service,I love their customer service. They stayed with me for hrs fixing my problem. And the quality of the products are top-notch,SA
136,www.microsoft.com,2022-11-04T11:49:38.000Z,1,They didn't Invent the Computer..,"Microsoft has a de facto monopoly on software for personal computers; which has really harmed computing - giving the expectation that buggy, badly written software is acceptable and the norm. And crushing innovation as well.  Both OS and application software lacks a quality feel, consistency and useability. Something that Apple have managed decades before Microsoft (and Microsoft copied badly).  At least ancient Windows 3.1 was consistent. Since then there's been a dumbing down of GUI's, complete with every MS developers own favourite way of doing things creating a dragged out inconsistent interface.  Been using Microsoft products early 1990s. The fundamentals haven't really improved; a company more interested in future products, which are always a year or so away, rather than delivering good quality consistent products to the user now. Could be argued everything up to Windows XP was just a massive fix for something that wasn't fit for purpose or even a proper OS. On/off hit/miss versions of the OS since.  And remember we've moved from software licensing where you had a right to use the software you bought, to rights restricted to particular hardware, to  subscription limited usage. And in future a secure computing platform tied to Microsoft products entirely. Which is great for Microsoft but gives the user little additional benefits for the overall greater cost of ownership.",GB
137,www.microsoft.com,2022-12-22T14:44:34.000Z,1,Definitely would not recommend,"Date of experience:   December 18, 2022",GB
138,www.microsoft.com,2022-09-24T14:14:02.000Z,1,Incredible how bad there customer…,Incredible how bad there customer service is !! Impossible to contact them completely useless,GB
139,www.microsoft.com,2022-10-05T05:20:02.000Z,1,MICOSOFT ARE NO LONGER THE COMPANY THAT BILL GATES CREATED,"Dreadful company !!!! They will  not answer any of my questions and are only interested in money. Microsoft have withdrawn support from my Windows 7 so I can no longer print out documents in Excel and Word from Windows 7 (and my mate is struggling too with Windows 10). They are forcing me to pay extra for Windows 11 which is NOW a subscription service, whereas Windows 7 was NOT ! I would have to buy a new computer to run Windows 11 which would be very expensive when their is NOTHING wrong with my wonderful HP Desktop computer (Pavilion 23) at a time when I have just been scammed out of £55,950 and when my gas and electricity bills in England have risen from £500 a year to approx £5000 (even higher if prices rise again in Jan 2023 by 80%, as mentioned by moneysavingexpert Martin Lewis last week). Some of my Microsoft complaints are bounced to a company JUST ANSWER who tell me that they are in no way allied to Mirosoft but their site pops up  when you try to complain to Microsoft if they are not allied to Microsoft why does this happen? This is a pathetic way of not dealing with customer's concerns from one of the largest and richest companies in the world. Its standards and values and care for its customers has taken a real nosedive. I cannot believe Bill Gates had this in mind in its early stages. SDuch a pity !!",GB
140,www.microsoft.com,2022-05-14T16:20:06.000Z,5,Microsoft products are great,"Microsoft products are great. I am using Windows, Office and few of the other products. I would highly recommend.",US
141,www.microsoft.com,2022-03-24T08:52:10.000Z,4,Good,Each company has its own goods and bads. But my experience is quite good. Haven't faced any major problems so far.,IS
142,www.microsoft.com,2022-11-30T23:40:13.000Z,1,Worst experience ever!,Unable to create account due to their robot test!,FR
143,www.microsoft.com,2021-12-20T21:27:19.000Z,1,How to frustrate a Customer,"I was advised my payment for 365 failed to process and I attempted to change the funding source.. Let the tale of woe begin. Trying to change payment type was a disaster, led round in circles time and time again to the point I nearly scrapped 365 altogether. Every attempt I made to pay the €7 was either “bad request” or payment was declined via PayPal. I was asked to renew the subscription, guess what! back to the payment page “ bad request” and “payment declined “ via PayPal. I spent over an hour trying to make the damn payment. I am fully tech savi, how a layman would negotiate this nightmarish process is beyond me. I had to end up cancelling the subscription and subscribing again. Come on guys, if I want to change my payment open (even if the account is past due) please let me. I’m cross even recalling this procedural farce. I decided to eventually dump the subscription and buy office 21, please don’t say you will miss out on certain benefits, I don’t care! I would also advise you have a large button to press to speak to a real person, not bury it under layers of automated nonsense, providing answers to a question not asked. 0 rating from me.",IE
144,www.microsoft.com,2022-02-06T08:55:23.000Z,5,Why Microsoft got such low rating?,Wow. What happend to Microsoft to get such a low review? Must be the guys at apple giving it bad reviews??,US
145,www.microsoft.com,2022-07-29T16:27:13.000Z,2,Making good software is not that hard,"While most of their software works alright, they are pretty hard anti-consumer. While claiming that Windows 10 would be the last version of Windows so you didn't have to upgrade every few years for arbitrarily gated upgrades, they now decided that they want more money again and released Windows 11.  Which is so far a buggier and uglier version of Windows 10. They aggressively try to make you switch to their Edge browser, with which they are trying to push ads on you. Their Store is unique in a way that it has a lot of bugs so basic things like uninstalling apps is not supported. Unlike all other software stores where you buy software and then you own it that is no longer the case here. Here you just own a license which they can take away at any time and they don't have to provide a reason to do so.  The Microsoft store is also the only store that installs programs in fixed location instead of letting you choose it. They then also remove your access to these folders even though they are on the PC that you own. When you try to force back permissions to be able to access and change the software you bought it will most likely be bricked and no longer useable.  This causes games and software to be unmodible and bricked as time passes on. I wouldn't recommend buying any software at their store.",NL
146,www.microsoft.com,2022-06-08T22:06:28.000Z,1,My friend Pasha told me that u guys are…,"My friend Pasha told me that u guys are really mean to him. STOP THAT RIGHT NOW!!!!! thx, kiwi",DE
147,www.microsoft.com,2022-04-27T08:39:06.647Z,1,Terrible service,Terrible service.  Not taking the responsibility of product failure.  Terrible customer service,HK
148,www.microsoft.com,2021-03-31T16:10:48.000Z,1,#Worstcustomer experienceever,"Dear Microsoft, 1. I've called your customer's support 3 times. Each time you can't help me immediately, but promise to 'escalate the issue' and call me back the same day. You have failed to do so. 2. My issue is that my bank account is being charged for a product that is not mine. This is a rather serious issue, as it's fraud. How come you refuse to help me stop this payment being charged? 3. How come you refuse to figure out who is charging their product to my my bank account? 4. How come you give me a 'ticket number', yet write nothing down, so that each time I call you, I have to explain all of this again - and explain that my email is not linked to the bank account that's being charged? (you guys are actually recording all the conversations 'in order to improve your customer services', and improvement you could really use) 5. I am now calling you for the 4th time, your personnel keeps sending me through to a new person everytime they here the story, and now, just into nothingness (nobody is picking up, just nothing).. 6. so I guess I'll have to call you again.. Kind regards,  One rather angry and very frustrated 'user/customer'..  #worstcustomerexperienceever",DK
149,www.microsoft.com,2022-05-03T00:45:34.000Z,1,"Inefficient and circular chat ""support""","Getting through to customer service is a mess; you need to log in, agents are incredibly slow and you keep getting case number/ticket after case number/ticket. I had to sort up an entire new account just to get a hold of the customer service chat. Forget about recovering access to an account you had but forgot the password to if it was linked to a phone number no longer in use. The password restoration process is singular and run purely by ""bots"" and you're way out of luck if you can't remember the most miniscule details of what was the title of your most recent email, and the specifics of some of your Skype contacts (who even uses Skype these days???)  I described my issue in graphic detail, offering very specific  information regarding recurring emails in my inbox, outgoing emails (to Kindle) and references to what was stored on my OneDrive. No go; referred back to the same damn standardized form yet again (or as they call it; ""single secure process""). Lots of my key accounts (PayPal, remote work, Amazon, Kindle etc) are linked to this account; not to mention all the files stored on my Drive. Password restores for these are hopeless. Eternal loops of escalations and being forwarded, only to end up back at square one. Immensely frustrating and incredibly disheartening.",ES
150,www.microsoft.com,2022-07-25T23:25:39.000Z,5,Microsoft is a company that I would buy…,Microsoft is a company that I would buy anything from! Love their Surface products,US
