,site,date,stars,title,text,location
274,www.twitter.com,2021-06-16T06:08:16.000Z,1,The site TWITTER is not good no more…,This site TWITTER is not good no more my accounts were suspended 3 months ago and getting them unsuspended YOU CANT they say the case was closed over and over again Not for nothing the owner is a pot head we were told and If you heard him on television it showed he had no self esteem what so ever BILLION AIRS AND THE RICH think they are better than witch is so so wrong and you cant take it to the grave. These old sites Twitter and Face Book made it because the internet was new Now the people use them for advertising the only way to get good vision is pay for it. The ROI is horrible it used to be good no more and he proved to America that he is  not a good person For what he did to Donald Trump the Guy is a no one THE OWNER OF TWITTER NOT TRUMP. He is a demarcate and is not worthy of the AMERICAN people in a situation like this he should of never suspended his account Because the lies that Nancy Pelosi was saying was to manipulate the election and that's exactly what they did. Look what we have for government Its a JOKE he is not a leader but an old man that does not know what he is doing and is afraid of Television he is online in Social Medea witch is more for friends and family and business to communicate not for a GOVERMENT TO manipulate the NIEAVE people that is what the people in social media are most of them look what they voted in for a president a no ONE. PEOPLE THAT LOCK YOU OUT OF AN ACCOUNT ARE COWARDS HIDING BEHIND THIER COMPUTERS. God Said In the Bible That Socialism is Evil. And the people still use it that means we have a world of ? MONEY IS ROUT OF ALL EVIL AND THESE ARE THE MILLIONAIRS AND BILLIONAIRS GET THAT MONEY. DONT GET ME WRONG I STILL LOVE THE INTERNET          TO AN EXTENT.,US
275,www.twitter.com,2021-06-14T09:48:34.000Z,5,it's good when your mood is bad,it's good when your mood is bad . I can write anything when i thinking .,TH
276,www.twitter.com,2021-06-13T11:43:16.000Z,1,People who worship cancel culture should be banned!!,Whatever you do on the internet never say a racist comment that you really don't mean as otherwise these liars will immediately think you are awful and must be banned.,US
277,www.twitter.com,2021-06-13T07:25:15.000Z,1,Admin of Twitter are racist snd fascist,Awful - shut me down without an explanation. I am giving them a 1 rating on all review boards. 🤣🤣🤣,GB
278,www.twitter.com,2021-06-09T08:35:14.000Z,1,why do teens get everything 😔,its 13++++++ like whyyyy is every app 13+ why only teens get priorities,GB
279,www.twitter.com,2021-06-08T03:03:35.000Z,1,This jerk Jack Dorsey should be in jail…,"This jerk Jack Dorsey should be in jail for what he is doing, blocking people that talk about DONALD TRUMP. Jack Dorsey wishes he had the class that Donald Trump Has, Dorsey is a BIG GET that made it big on the internet and him as a person is selfish self-centered and DISGUSTING. I hope someone puts him in his place one day, he is a coward that hides behind a computer and blocks you thats a coward not a man.  And again did you see him on national television when the congressman made him look like a WEASEL thats what he is Ill tell him, to his face i dont care how much money he has It just makes him a bigger JERK. This dude is worse than a goat Look at him.",US
280,www.twitter.com,2021-06-05T20:18:39.000Z,1,Narcissistic Users & Awful Service,"I've thankfully never dealt with a Twitter mob, but what people do to others while pretending to be good people is insane, and I'd rather not mix in circles where extremists roam or where people prioritize the court of public opinion rather than facts and evidence. The creator clearly enables this behavior to benefit himself and his own popularity, even if it's in a cesspool of a toxic mess, and doesn't care for anything else and Twitter is generally for gossip and harassment of a person you don't like nowadays and I'm surprised that people still use it. Proana and ProPedo accounts are notoriously bad on there and I've reported them in the past only for them to get no consequences. I left Twitter months ago and have never looked back and the majority of people who use it have an unpleasant personality.",GB
281,www.twitter.com,2021-06-05T23:59:03.000Z,1,Help is disgusting,Twitter only care about themselves. That i how i feel after the way they have treated me. yes im responsible for the tweets but i did not know that it had to be sent private and at the time was very busy with work.I have sent them so many requests to remove a couple of photos and writing that is not professional and also embarrassing for my family. i even have tried apple and  twitter would not help.If i  got just a bit of the money you earn id still do a better job because all humans do silly thinks but many don’t expect it shown to the world unless on private.  Im a frontline health worker and love caring for people. You i feel dont as you have completely ignored me and the stuff on google search are so easy to be taken down but its just to hard a task for you. Google will not remove as they feel its come from your site and not their responsibilty. Its YOURS!!!!!! You have caused me so much stress !!!!! It’s just awful what you have done,AU
282,www.twitter.com,2021-06-05T04:06:27.000Z,1,I had bad experience with Qatar…,I had bad experience with Qatar airways. There was no help and staff was rude and I missed flight and also charged no show fee,US
283,www.twitter.com,2021-05-27T17:41:41.000Z,5,Twitter rocks!,"I understand everyone is entitled to their opinion of how they have been treated, but I give twitter 10/10, good service, friendly staff and nice people.",GB
284,www.twitter.com,2021-05-27T05:33:28.000Z,1,I can't believe Twitter shut me down…,"I can't believe Twitter shut me down for no reason, this is ridiculous I did nothing wrong ,not to mention they won't tell me why they permanently suspended me.This is the first time this has ever happened to me😪I even email them they just keep saying the same thing !",US
285,www.twitter.com,2021-05-26T15:53:10.000Z,1,I wish I can give a zero,"I wish I can give a zero, #FreePalestine",NL
286,www.twitter.com,2021-05-26T14:22:43.000Z,1,I need to reset my password,"I need to reset my password, but I can not receive it",US
287,www.twitter.com,2021-05-26T23:21:54.000Z,1,Twitter support being silly,"I had a case with twitter because my account was falsely accused of impersonation (we are a business account). The person used a hacked verified account then accused us of impersonation. Hacked my personal account, blackmailed me and then I just get bots from twitter and my case gets closed for literally no reason specified. Case #0210033435 Twitter then just closes the case without any reason or communication. I'm now up to my third appeal and still haven't reached a human",AU
288,www.twitter.com,2021-05-26T06:35:55.000Z,1,"Wow, Avoid if you want to keep your sanity.","Wow.. Censorship is real and you can't get a resolution with Twitter.. I made a tweet on the BBC news page saying I am glad Max Verstaffen had beaten Lewis Hamilton in a F1 race.. This fell foul of the twitter police, they put me in twitter jail for a week for an innocent comment.. I suspect it is because twitter are engaged in this black lives matter woke thing and it is now illegal in twitter land to be negative against any black person, so I'm not allowed to support a foreign white racing driver over a black British racing driver... Twitter censorship has gone bonkers.. Don't go there it will make you frustrated, sad and attacked daily by true Bile.. Bile that is allowed from a increasingly far left propaganda blog..",GB
289,www.twitter.com,2021-05-26T03:12:25.000Z,1,Oh boy where do I go with this review,Oh boy where do I go with this review. All I can say is one word. Twitter is.... TOXIC  I sometimes think it’s worse than TIKTOK,US
290,www.twitter.com,2021-05-25T08:05:42.000Z,1,Very bad experience,Very bad experience. Insane censorship. Lying fake platform. Satanists cabal minions,DK
291,www.twitter.com,2021-05-25T04:00:35.000Z,1,No freedom of speech.,"Date of experience:   May 25, 2021",GB
292,www.twitter.com,2021-05-24T22:08:24.000Z,1,Same as I rated FB and for the same…,"Same as I rated FB and for the same reasons...the difference is j deleted my Twitter bc I dont have pics and family on there. You choose to cater to terrorist, pedophiles, and satanist who lie, give opinions as facts, and cause harm and destruction to our nation and people but you silence Patriots who love our country, God,and our President Trump. We are silenced for loving freedom, the constitution, and our rights as citizens to refuse the jab. You promote propaganda and misinformation and ban truth, data,, and facts to back it up.  You will be obselete like all the woke actors and emtertainers and sports players no one watches any more. We outnumber you. We are the taxpayers. We are the majority. You helped them steal an election with these tactics along with silencing pedo hunter facts and proof. You are all going to lose everything. We have platforms we can speak truth freely on and will never go back to yours. You committed crimes and it will catch up with you. All of you. We are a constitutional Republic and you all committed treason. But silenced us? For sharing facts? I wish you could have been what you made us believe you were. I will pray for you all. May God have mercy on your souls.",US
293,www.twitter.com,2021-05-24T07:30:58.000Z,1,Twitter is no longer a free platform…,Twitter is no longer a free platform where people can discuss matters openly. It’s hugely censored now and not enjoyable to use,GB
294,www.twitter.com,2021-05-23T11:35:10.000Z,3,"Great for news and updates, but significant improvement is required","Twitter is one of my favourite platforms due to how much information is at your fingertips at a push of a few buttons and clicks. But this platform has a serious echo chamber problem, its culture is shockingly poor and the company itself does not take complaints of antisemitism seriously. You guys need to improve, you do a lot of good but the reputation is plunging fast.",GB
295,www.twitter.com,2021-05-21T08:23:27.000Z,3,I always lose followers for no just…,I always lose followers for no just cause. Last two months I lost up to 400 followers within two days and last night I lost 60 followers. This is not fair at all😞😞,CA
296,www.twitter.com,2021-05-20T08:57:55.000Z,1,Unfair censorship of people’s freedom…,Unfair censorship of people’s freedom of speech and the back of Zionist state.,GB
297,www.twitter.com,2021-05-19T16:59:48.000Z,1,Twitter are banning and blocking…,"Twitter are banning and blocking content that is in the favour of Palestinians. Twitter is clearly a platform that does not support freedom of speech. They support apartheid, illegal occupation and murder of innocent people. FREE Palestine",GB
298,www.twitter.com,2021-05-18T17:16:36.000Z,1,You can't say whatever you want.,"Date of experience:   May 18, 2021",MA
299,www.twitter.com,2021-05-19T00:42:46.000Z,1,No freedom of speak.,Twitter accepts only tweets that represents their political point of view.  I called Benjamin Netanjyahu a terrorist and got banned! Probably a moderator who banned me supports the actions of Israel.,FI
300,www.twitter.com,2021-05-18T14:25:24.000Z,1,Racial profiling and supports the…,"Racial profiling and supports the terrorism of Israel, absolutely disgusting.",GB
301,www.twitter.com,2021-05-17T20:53:04.000Z,1,I don't like it,"Date of experience:   May 17, 2021",SA
302,www.twitter.com,2021-05-17T11:20:33.000Z,2,Censorship galore,"Twitter will always censor military pictures, yet will allow bots to spam scam links and 18+ images. Disgusting!",NL
303,www.twitter.com,2021-05-16T19:57:42.000Z,1,Just Deactivated twitter account so…,"Just Deactivated twitter account so much pressure from minority twitter only support certain people , if you have different opinions you are not qualify this is too inhuman",US
304,www.twitter.com,2021-05-16T00:00:16.000Z,1,Im Desperate please help me,Please write back     I'm Begging youPlease help me ive been trying to contact Twitter support for 2 years now but they never. Respond There's a therd party attached to  twitter account that has been posting tweets on My twitter feed that I never posted there's apps on my twitter account that I was not aware of I've asked twitter support to remove them alots of times and instead they suspended My twitter account for 2 year's My twitter account osirisomg means the world to me please help me get it back that's all I'm asking please    Ive asked twitter support via email alots of times 2 review My case I'm stuck in an endless loop of the same automated response email s. I have never used someone else is copyright matirial I'm sure the person that made such copy right clams dose not own such material that to my understanding has been removed from my twitter *******@osirisomg I can't send proof or URL s or links of something I never posted and that has been removed from my twitter account all I'm trying to do is get my twitter account back and the copyright strike off My twitter account I'm sure 100 percent there false copyright clams they can't clam to own something they stole from the original owner please help me   How can twitter support not realize that it's taking them More then to years now to review something that is no longer available on My twitter feed right ??   while I'm being harrised lost my job all of My contact s what are they reviewing the person that made the false copyright claim s did not even give twitter his name or address as a matter of fact he does not even own or represent the owner s of the copyright material,US
305,www.twitter.com,2021-05-09T11:19:46.000Z,1,Jack Dorsey is the number one…,Jack Dorsey is the number one bullshxxxer in the world. Anything that suits the rich liberals!,GB
306,www.twitter.com,2021-05-08T19:30:46.000Z,1,Such a BAD app,"Such a BAD app! And when I want to use it, it F doesn't work!!! Piece of S.",FR
307,www.twitter.com,2021-05-08T14:44:38.000Z,1,Twitter is s(i)ck,"Twitter is suck, and the most of the comunity is sick. Twitter, their team and the support itself, don't even know 1% of what happens with the platform, the funniest: These days I was talking about doing a battle royale with BTS fans, and my tweet was deleted and I was unable to tweet for 9 hours, meanwhile, sick people demonstrate and dominate the site with pedophilia, gore, violence (for real) share sick and disgusting things, and what does twitter do? he simply considers that sick person's tweet to be ""inappropriate"" but they don't ban it or anything, they get away with it, they don't use twitter except to follow a funny page or something.",BR
308,www.twitter.com,2021-05-07T21:52:51.000Z,5,fantastic job for twitter team!!!,"Date of experience:   May 07, 2021",CM
309,www.twitter.com,2021-05-07T01:23:46.000Z,1,Wow 1.5 star average review,"Wow 1.5 star average review. Most businesses would go under with that, oh wait they just delete your account if you disagree. My account was froze for saying vp harris should go to the border. come on man. Don't care since I only joined when trump came on board, now no reason to watch woke culture. In 5 years they will be in the same category as blockbuster video, gone. I requested my account to be deleted, they only froze it so they can count my account as active for stupid advertiser's that pay based on amount of users.",US
310,www.twitter.com,2021-05-06T06:01:23.000Z,1,Worst social media platform ever,Worst social media platform ever! They wrongfully suspend accounts for speaking out against the racist and hateful Tweets that are never removed by Twitter. Twitters  lack of action only encourages hate. App has been deleted from all my devices. I want nothing more to do with them. Just read all the other 1-2 star reviews on here.,US
311,www.twitter.com,2021-05-02T07:17:56.000Z,1,Trashy Platform That Symbolises Anti-Online Privacy,"Common sense on Twitter has been replaced by authoritarian censorship that causes narrowmindedness, stupid racism, virtue signalling, snowflakes, and people acting like they got a victim complex instead of taking accountability. This platform is filled with people who act like overly emotional children. Also, this platform doesn't let people have online privacy when registering Twitter accounts. Because people will be locked out of Twitter accounts until they give up their phone numbers or government I.D.s. Which tells me this platform has people who put profit over online privacy. Also, this platform goes against open-minded conversations and logical debates through authoritarian censorship. What makes this platform silly is that people can only write Twitter posts less than 280 characters long...",FR
312,www.twitter.com,2021-05-01T20:57:26.000Z,1,Account suspended,"My account was suspended for no reason or no one replied to my case and specify  the X'reason - it's already 1,5 month since then. I opened an account few months ago and mostly just follow few areas which I'm interested. Probably I posted 2-3 times being a Twitter'user. I totally understand that we live this unsecure times and Covid19 has it's own print on it, but this is not an excuse to treat your customers. 👎 My rating is: -5*⭐",IE
313,www.twitter.com,2021-04-30T22:47:46.000Z,1,Think when you divide the country as…,Think when you divide the country as much as you can.  Run what you think the best and promote racism.    Why your growth stock price the way it’s going.    I closed my account down as no free speech.,US
314,www.twitter.com,2021-04-30T11:33:53.000Z,1,Fradulent och political immoral,"Fradulent och political immoral Heavly involved with EVRYONES politics, but at the same time they support and endorse pedohpiles and group harrassment.",SE
315,www.twitter.com,2021-04-30T10:24:56.000Z,5,Satisfied with this application,"Date of experience:   April 30, 2021",US
316,www.twitter.com,2021-04-29T14:05:19.000Z,4,Far much better like Facebook.,"Date of experience:   April 29, 2021",HR
317,www.twitter.com,2021-04-29T00:59:39.000Z,1,Thoroughly stupid,Thoroughly stupid. NO Customer service NO Customer service. Suspended my account because I logged in on my laptop whereas I usually use my mobile phone. The account is linked to an email address I no longer have. Twitter insists on sending an email to that address and has no other means of solving the problem. I set up a new Twitter account with my new email address but it has linked it back to the old one and will not let me use it without a code sent to the old email address that I did not mention in setting up the account. Thoroughly stupid IT people.,AU
318,www.twitter.com,2021-04-27T12:54:29.000Z,1,Twitter is racist.,Twitter allows people of colour to post racist crap against white people with no fault whatsoever yet when you go to fight those people stating the racist garbage ypu get freaking censored!!! Twitter is nothing more than a leftie haven now. Absolute garbage. They should not be allowed to censor free speech!!!,CA
319,www.twitter.com,2021-04-27T09:03:09.000Z,5,At least it's far better than Facebook,"Fewer ads, a great platform that helps me follow my idol, I feel more comfortable using Twitter. On the other hand, Facebook is rubbish",BD
320,www.twitter.com,2021-04-24T23:28:44.000Z,1,Keep suspending me for no reason,"Date of experience:   April 24, 2021",GB
321,www.twitter.com,2021-04-22T16:38:33.000Z,1,"Very nasty company who won't ""talk""…","Very nasty company who won't ""talk"" with me at all. Suspended this 68 yr old lady for no reason at all.  I am certainly not a threat or using bad words.  They are horrible - I asked that they cancel my account and they WILL NOT.  They leave my profile there so their stock doesn't go down - I imagine they have thousands of good folks kept this way so their numbers aren't so far down.  I wouldn't use them again for anything in the world.  Suggesting others find a better social media without all the political biase.  Thank you.",US
322,www.twitter.com,2021-04-22T14:36:38.000Z,1,suspended by a bot,suspended by a bot for inaccurate reasons.  i'm disabled and cannot interface with organizations I need to.,US
323,www.twitter.com,2021-04-22T00:43:04.000Z,1,WORST attempt at 'Customer Service',"Their customer service is absolutely RIDICULOUS. Actually, I won't even call it customer service. It's an automated loop of 'We can't verify that you're the person you say you are' without actually having a HUMAN to talk to. It is ALL through email, no names of a person attempting to help you, and canned messages that aren't even addressed to you. It is an absolute joke. They should be ASHAMED of themselves.",US
324,www.twitter.com,2021-04-21T17:25:27.000Z,1,Absolutely the worst customer service…,"Absolutely the worst customer service ever, they don't answer you anywhere, just pathetic links which won't help you",GB
325,www.twitter.com,2021-04-18T16:19:36.000Z,1,Twitter censors and are therefore…,Twitter censors and are therefore unreliable as a social media source. They should be censured. Dorsey is a pompous ass that should be jailed.,US
326,www.twitter.com,2021-04-18T15:38:30.000Z,1,Appalling Web Site,"I joined this site as a quick way of receiving news from several other sites, having all the news tweeted to me rather than search the individual sites. I had already set up an account many years ago which I did not use, so I utilised that. I removed the old followed sites and attempted to add the new ones. At that point, instead of getting a welcome greeting off Twitter, I was banned for 3 days for breaching their following policy. Surely the whole point of the site is to follow people? Lets make the ban permanent shall we Twitter? I will help you out by deactivating my account. I don't want to deal with an unwelcoming company, so any money I spend on adverts will be done through Facebook instead. You always were and always will be second best.",GB
327,www.twitter.com,2021-04-13T03:56:57.000Z,1,twitter sent police to a podcasters…,"twitter sent police to a podcasters home for being tagged in a threatening post, is this something you want to be apart of..... Toxic enviroment to think that after Covid and Ricky Gervais talk on the oscars you think people would be drawn away from fake idols.. This site should be deleted, how was it possible that it literally perma banned a president and people still use it",AU
328,www.twitter.com,2021-04-12T02:09:25.000Z,5,At least it's more pleasant than facebook,"it doesn't have as many community standards as facebook, fewer ads, a great platform that helps me follow my idol, I feel more comfortable using twitter. Facebook is rubbish",VN
329,www.twitter.com,2021-04-11T08:01:14.000Z,1,One of the worst companies ever!,"A truly terrible company who don’t give a dam about their customers. And trying to talk to their no existent customer service is a joke, don’t waste your time. Twitter is just a propaganda tool for the rich and powerful and should be closed down! If I could give 0 stars I would.",GB
330,www.twitter.com,2021-04-11T05:09:29.000Z,1,Rosie O'Donnell violated Twitter rules…,Rosie O'Donnell violated Twitter rules by harassing both sexually and said she was going to bribe politicians for the vote she wanted. How does she get away with this when if a man said those things to a woman or anyone would openly offer a bribe to a public official they would be prosecuted and kicked off Twitter!?,US
