,site,date,stars,title,text,location
0,www.twitter.com,2023-01-11T11:01:43.000Z,2,Gives me anxiety,"Toxic community, confusing to use, 200 letter limit, Elon musk. I'm only still using it to try and figure out how to promote myself as an artist and gamedev. Don't bother. Unless you like it at first, in which you're lucky and will probably enjoy twitter and be successful on it.",AU
1,www.twitter.com,2023-01-08T12:14:14.000Z,1,My account was blocked...,"My account was blocked without any reason and appeal was never reviewed. I am pushing support since November 2022, but nobody cares :( They can block your account, or AI blocks it, and you can do nothing about that. All I want now, it's just to activate my account to delete it. As I can't delete it because it's suspended :| So even separate ticket for account deletion also stuck and nobody care. Gosh...",PL
2,www.twitter.com,2023-01-09T08:38:24.000Z,1,The new APARTHEID TWITTER is in full effect!,"The new APARTHEID TWITTER is in full effect. Apple and Google should ban this now MAGA platform. The Apartheid Twitter of Elon Musk allows thousands of pages that only share videos that stereotype Black Americans and others. Those profiles are never taken down but the black pages that respond are suspended permanently. And why do I need the permission of racist, anti black Twitter to deactivate my information, but they don’t need my permission to deactivate the page?! Twitter is compromised.",US
3,www.twitter.com,2023-01-10T23:10:39.000Z,1,This must be my 7th ban now on Twitter,"This must be my 7th ban now on Twitter, banned for 7 days for simply swearing back at someone who randomly started replying abuse to me, he's not banned though..probably because he has the Ukraine flag in his name like a good sheep. Just goes to show no matter who takes over Twitter it will always be the same, no free speech at all you cant even swear on it, when you have a app that relies on bots and woke employees to dictate whats free speech this is what you end up with. All my bans have been for either my opinions on certain subjects that doesn't fit the narrotive or for simply answering someone back in the same manner they did to me. Want to be able to roam Twitter without being suspended or banned? just put a Ukrainian flag in your bio or tweet in favour of covid and the jabs like a good little sheep and you'll be fine.",GB
4,www.twitter.com,2023-01-10T16:21:07.000Z,4,Easy to communicate with everyone and…,Easy to communicate with everyone and most importantly we finally get the freedom to speak the truth as it is. Happy about this user privilege.,GB
5,www.twitter.com,2023-01-04T10:52:17.000Z,1,The 💩'st app HAHAHA,"The 💩'st app HAHAHA. Musk the narcisist thinks that he's so smart, when he's not but an uneducated self centred celebrity who will soon collapse. Can't wait to laugh it out loud 🤣 He is so confused with politics that is laughable watching him from fake accounts. The guy is full of 💩",AU
6,www.twitter.com,2023-01-02T15:15:20.000Z,4,Twitter is great for helping me to express myself and develop my projects,"It's a very good website, of course. I think people on Trust Pilot usually come here to be angry and to express themselves in that way. You get a lot of negative reviews on Trust Pilot. But I think Twitter is a really great website. It gives me a voice and I can have several accounts each pushing a different 'message' / idea in my life. Twitter is helping me to develop certain ideas and myself / my life in general.",GB
7,www.twitter.com,2023-01-02T22:29:42.000Z,5,It's a very good  and professional…,"It's a very good  and professional website, of course. I think people on Trust Pilot usually come here to be angry and to express themselves in that way. You get a lot of negative reviews on Trust Pilot. But I think Twitter is a really great website. It gives me a voice and I can have several accounts each pushing a",US
8,www.twitter.com,2022-12-30T16:50:17.000Z,1,Wish I could give 0 stars,Wish I could give 0 stars. Banned permanently from twitter for calling a racist a moron. If you fit inside a certain bracket they will use any excuse to ban you permanently whereas others can be openly racist and abusive and not get banned. Backwards app for a backwards world. Good riddance.,GB
9,www.twitter.com,2023-01-05T19:24:39.000Z,3,Have been trying to get my account…,"Have been trying to get my account verified for over a month now and hasn’t been able to succeed, like other aspects of the platform nevertheless.",US
10,www.twitter.com,2022-12-30T19:17:51.000Z,1,"DO NOT USE TWITTER, ANYMORE!","I used to use Twitter a lot. I really loved the platform and its format when Jack Dorsey ran the company, but since Elon took it over, he kicks out news personalities, government officials...basically ANYONE that Musk doesn't like or doesn't approve of! He also kicks people off for using free speech! Isn't that what America is all about? FREE SPEECH? I saw on a website that says he used the words ""tiny testicles"" to demean and insult a Twitter user, but he kicks people off who use that sort of language, too!  DO NOT USE TWITTER, ANYMORE!   Since Elon Musk took over, there is no such thing as ""FREE SPEECH""!",US
11,www.twitter.com,2023-01-03T14:57:41.000Z,5,Far more matured than Facebook I’m…,"Far more matured than Facebook I’m switching totally since I started using them, it brings together a far much broader community together. Great idea.",FR
12,www.twitter.com,2022-12-24T16:53:31.000Z,2,I joined Twitter in 2013 but only…,"I joined Twitter in 2013 but only started using it often, a few years after that. I now use the platform on a daily basis. I dislike how it can be a bit too censorial so I docked 1 star for that. I also use other social media platforms like Mastodon, Minds, etc., but the many accounts that I follow on Twitter aren't on those websites. Overall, though, I'm happy",US
13,www.twitter.com,2022-12-31T20:43:23.000Z,1,Twatter,"Twitter is being controlled by America's totalitarian government authorities. Which is why users who expose America's war crimes are getting banned. It's a not a platform for investigative journalists who care about honesty anymore. It's become a platform of walking on eggshells to avoid getting banned by tyrants who lie through con artistry. Elon Musk doesn't care about free speech. He only cares about himself, especially his wealth. America never stopped having upper-class, white man privilege. Elon Musk became sucessful because of his elite family who were white. I am tired of Twitter's corporate virtue signalling. Also, I'm tired of Twitter's ridiculous rules that get violated by those who are in powerful positions. Which those in powerful positions never get banned. So, Twitter has become a mafia.",US
14,www.twitter.com,2022-12-22T10:02:47.000Z,4,Tweeting since 2011.,"I joined Twitter in 2011 but only started using it often, a few years after that. I now use the platform on a daily basis. I dislike how it can be a bit too censorial so I docked 1 star for that. I also use other social media platforms like Mastodon, Minds, etc., but the many accounts that I follow on Twitter aren't on those websites. Overall, though, I'm happy with Twitter and have no plans to leave.",IE
15,www.twitter.com,2022-12-26T05:14:17.000Z,1,Twitter is trash and they lied,"Twitter is a joke LOL. Even under Elon’s leadership, or especially so I should say. He promised banned accounts would be reinstated as long as you didn’t do anything heinous. So I decided to test it out. I tried getting my account reinstated that was banned in 2019. After going back and forth with Twitter support and them taking a ridiculously long time, they finally let me know today, on Christmas Day of all days, that my account won’t be reinstated. There was no explanation given, just a parroting of their old reasoning that doesn’t apply to my situation. Make no mistake, it’s just like the old Twitter in new packaging. Way to take a dying company and drive a stake into it. Stay away.",US
16,www.twitter.com,2022-12-26T20:12:08.000Z,1,"here is Elon's ""freedom of speech""!!!","here is Elon's ""freedom of speech"", Elon is LIAR and FRAUDSTER! my twitter account was locked some time 2015, got this message 26 DEC 2022: ""Hello, Your account has been suspended and will not be restored because it was found to be violating Twitter's Terms of Service, specifically the Twitter Rules against hateful conduct. It is against our rules to promote violence against or directly attack or threaten other people on the basis of race, ethnicity, national origin, sexual orientation, gender, gender identity, religious affiliation, age, disability, or disease. Additionally, if we determine that the primary purpose of an account is to incite harm towards others on the basis of these categories, that account may be suspended without prior warning. ..."" Thanks, Twitter",SE
17,www.twitter.com,2022-12-17T12:55:05.000Z,1,White peoples have been bullying Megan…,White peoples have been bullying Megan on twitter’s calling are monkeys names because she’s had a black blood and married to a prince what did she did exactly I’m standing for the couple they deserve to live in peace to raise their children and deserved to be loved giving my opinion twitter suspended me and those white peoples are still on twitter bullying Megan I’m not interested anymore on that rubbish called twitter the most important Harry and Megan are happy 😊,GB
18,www.twitter.com,2022-12-20T14:44:04.000Z,5,Good comedy website,"Always get a good laugh at the vaccine/US election/general conspiracy theorists. Best comedy site since cracked went downhill. Try and ignore the fact it's actual human beings thinking the things shared on Twitter though, or you'll lose hope for humanity.",GB
19,www.twitter.com,2022-12-21T10:17:11.000Z,1,This is a racist app that bully black…,This is a racist app that bully black people and permanently bans them when black people dont even violate the tos. Twitter refuses to let me delete the account. I believe they are inflated their number with banned accounts. Its disgusting,US
20,www.twitter.com,2022-12-23T20:31:33.000Z,4,The App looks great but I have a bit of…,The App looks great but I have a bit of a concern. I haven’t been able to change any of the settings on my twitter account and using the help page is useless just sends you round in circles.,ES
21,www.twitter.com,2022-12-08T03:25:03.000Z,3,Twitter is so much less invasive and…,"Twitter is so much less invasive and personal details do not get shared with others. There is a massive list of sites to follow and you would be hard pushed not to find something of interest. Do you like shouting at the telly when politics or sport is on? Get on Twitter and let others know your opinions and comments, you may be surprised how many people share the same views.",GB
22,www.twitter.com,2022-12-06T21:57:05.000Z,1,Concerned about personal data on Twitter,My Account was suspended in November and I dont know why.  I suspect that I was suspended either that my account was hacked or Elon considers me a Leftist threat as he does with others.  I have tried deactivating my account but the system won't let me.  I sent 6 requests to Customer Service to deactivate my account and no response.  I am concerned about my personal information on my profile.  I thought of contacting the attorney general to look into this.,US
23,www.twitter.com,2022-12-13T21:59:02.000Z,4,Very happy with the company,"Very happy with the company, I like being able to share and allow my customers to retweet my advertisements. These can potentially bring more clients, and it's always great to get free marketing.",NL
24,www.twitter.com,2022-11-29T10:43:26.000Z,1,Absolute shower of rubbish,"Absolute shower of rubbish. No support whatsoever and any requests for assistance just ignored. My account remains hacked and all they have done is suspend it like I’ve done the breaches myself. It’s their security which has failed as all of my other Apps, including other social media platforms, are working perfectly.  Unaccountable and useless team of support agents employed here. Time to move away from this ridiculous company, run by a bloke with his head in a vacuum.",GB
25,www.twitter.com,2022-11-29T05:18:18.000Z,1,This site started allowing racist and…,This site started allowing racist and other derogatory posts and comments which gave right wingers a license to start attacking people for no reason and making threats without consiquence. I originally was on there for music and entertainment purposes but had to delete my account. Elon Musk really screwed up.,US
26,www.twitter.com,2022-12-25T17:54:45.000Z,5,Awesome social media,The only social media where you can actually get content without getting bombarded by useless information/content and ads,VN
27,www.twitter.com,2022-12-13T21:52:10.000Z,1,Twitter does not have email…,"Twitter does not have email verification.  Simple as that. If they make you verify, They give no option to use anything but a cell phone, I don't use cell phones. So pis.s on Twitter.",US
28,www.twitter.com,2022-12-26T18:22:41.000Z,1,Kingdom of bots and frauds.,"Kingdom of bots and frauds. I used to love and use it but no more. Good bye Elon, master of the free speech!",GB
29,www.twitter.com,2022-11-29T19:45:19.000Z,1,Shambles under Musk. I'm out.,"The people I followed have mostly quit posting since Musk tookover - the bigots & fascists have taken over. I cannot associate my business with this cesspit. The new CEO's ethics towards staff are appalling, and his welcoming Trump back was the last straw.",GB
30,www.twitter.com,2022-12-11T20:51:09.000Z,1,musk is an ultra maga,"twitter deserves a negative score, -10 stars. musk has turned it into ultra maga land attacking Dems/Liberals. its financed by the saudis and putin. he tweets hate speech against our Dem Reps, Science, POTUS, DOJ, Medical professionals and Covid Experts,  and allows hate speech and racism. he reinstated trump and the likes of kyle rittenhouse. Libs are suspended and our accounts are messed with, we lose followers and magically are following magas without our knowledge. he's allowing doxxing as well. People are leaving in droves to other social media platforms daily. he fired all his staff that were to protect against EVERYTHING he himself is doing. he can have twitter....I hope the FCC and DOJ sanction him. Side note, he's no genius, he bought Tesla from the developers, he ran that into the ground too.",US
31,www.twitter.com,2022-12-19T11:20:24.000Z,1,Twitter is broken,I haven’t been able to change any of the settings on my twitter account and using the help page is useless just sends you round in circles,GB
32,www.twitter.com,2022-12-22T10:18:28.000Z,1,Social media is rotten and likes to…,"Social media is rotten and likes to make things difficult for users. Don't use this social media, guaranteed to be disappointed.",ID
33,www.twitter.com,2022-12-17T08:07:03.000Z,5,Wish I could get back in…,I love Twitter now! Pity I can’t participate since I was exposing the stolen election in 2020 I got permanently suspended and can’t get back on.,US
34,www.twitter.com,2022-11-16T02:37:26.000Z,1,Support is non-existent,"Support is non-existent. I have been waiting on an issue to be resolved revolving around a 2FA issue. I opened the ticket on November 2nd and as of November 16th, I have heard nothing from them. I have sent many emails and other messages, but the silence from them is deafening. They do not care.",AU
35,www.twitter.com,2022-11-01T22:04:51.000Z,1,Double Standards…,"People on Twitter (politicians) post about the attempted murder of an 82 year old man (the spouse of a member of congress). They crack jokes about the man and pass tasteless comments. Yet, if you post a reply, you get suspended by Twitter. Why don't they suspended the accounts of the idiot low life politicians instead? The owner of Twitter was also publicizing jokes about the attempted murder as well so, I guess such posts are OK.",US
36,www.twitter.com,2022-10-13T22:48:21.000Z,1,No feedback or support,"Exactly same experience, account blocked but no clarification or explanation of why? Well actually because of hateful comments? Such as basic facts russians terrorists etc free speech or opinions are censored and NO clarification of what the reason or the “hAteful?” Comments that I posted?  no customer support.",CA
37,www.twitter.com,2022-11-06T19:59:59.000Z,1,Terrible,"Terrible, absolutely aweful. Staff treat you like a criminal if your comments don't fit the twitter narrative. What narrative I don't know. So sad, that free speach and cancel culture has infected our ability to freely discuss.",GB
38,www.twitter.com,2022-10-14T06:51:49.000Z,1,Censorship.,"Since Trustpilot removed my review for no valid reason I’m going to rewrite it. Twitter is full of mis*gynists, p*d*philes and child p*rn and Twitter protects them too. You report them and they do nothing. Trustpilot deleted my review for saying this and telling me it was obscene. Yep. No joke.",US
39,www.twitter.com,2022-10-01T07:57:55.000Z,1,You guys are losers Twitter,"You guys are losers Twitter , When the truth comes out about a president committing war crimes yes we are talking about Putin the new Adolf Hitler of the world, then you get blocked because you are not allowed to speak it says everything about your S…Page Twitter, Deleted my account Will not support something that is false And who can not stand the truth To 🤮🤮",DK
40,www.twitter.com,2022-09-28T14:46:02.000Z,1,Twitter is useless,"In 2020 Twitter made 3.7 billion dollars. Yet, they cannot afford good customer service. An app which is used by billions of people, including celebrities. Not one person has answered  to my emails, they have no phone number and no email. I think someone should set a GoFundMe me for Twitter, the poor site doesn't have enough money for looking after its users. Poor thing.",GB
41,www.twitter.com,2023-01-09T02:00:21.000Z,1,very bad service!!,"Date of experience:   January 08, 2023",ID
42,www.twitter.com,2022-09-22T05:36:56.000Z,2,I hate that Twitter comes with its…,"I hate that Twitter comes with its biases. Some open some hidden. Its power to stifle accounts and opinions simply on a whim or on the premise that they disagree with the opinions of Twitter's biggies hits me really bad. I hate that Twitter's duplicity can be openly proven too, if you simply see Twitter's actions on two sets of similar cases, but on opposite ideologies. I find it difficult to support that, and that's a personal option, of course.",US
43,www.twitter.com,2022-11-16T13:31:34.000Z,4,New user but I've been on for almost a…,New user but I've been on for almost a week now and I've been allowed free speech without any manipulated punishments unlike Facebook who seem to twist things and inaccurately punish you.,GB
44,www.twitter.com,2022-11-14T11:25:59.000Z,1,Literally the worst,Literally the worst. Censorship is everywhere for real users while impersonators get to scam outta people. Fix your thing Twitter. You can't just keep locking/blocking/suspending people.,HK
45,www.twitter.com,2022-09-27T16:11:58.000Z,1,Very frustrated with Twitter,"Very frustrated with Twitter. I fell victim to a crypto scam due to a hacked verified Twitter account. Now I'm out thousands of dollars because Twitter can't secure its accounts, especially its verified accounts. Thanks Twitter, from all of us who put WAY too much trust in the verified blue badge.",US
46,www.twitter.com,2022-09-08T19:37:57.000Z,1,Suspended and Appeal function don't work.,"Got a one week suspension, tried to appeal but it won't let me appeal BECAUSE IM SUSPENDED! What is the point in having a contact center and appeal process when people can't contact you and can't lodge an appeal? I was suspended for calling someone who wished ""an excruciating death"" on someone a ""c**t"". Yet people wishing death on others is fine by twitter standards.",GB
47,www.twitter.com,2022-12-04T14:08:36.000Z,1,Stopped using Twitter from the numerous…,Stopped using Twitter from the numerous amounts of brainless people infesting this site and writing crappy tweets about asinine topics.,US
48,www.twitter.com,2022-09-01T02:42:25.000Z,1,Twitter is operated by people sympathetic to Fascists.,"Terrible, Twitter will randomly lock your account for a tweet. For example Tweet criticism of a fascist pretending to be a priest on Fox news saying that progressives are paedophiles, with no threats of violence or abuse in the Tweet....bam account locked! Showing a bias right there Twitter!  The hell with Twitter! At least train your Algorithm better!!",GB
49,www.twitter.com,2022-08-26T01:21:44.000Z,1,A bag of sh1te,"A bag of sh1te - no support, no way to contact. I haven't used it in a long time and forgot my password and username - there's no way to reset your password without knowing the username. The forgot your password site is asking for email address and then username and if you select ""I don't have that information"" (as in username) it takes you back to the reset your password site where you started.",US
50,www.twitter.com,2022-10-07T19:55:47.000Z,1,"Horrible staff, contact support is impossible",Is impossible to contact them to talk to a human being. they give me warning for doing stuff that other people do without any issue. they earn billions a year and dont even have an live chat or email to contact them. even worse then facebook!!,GB
51,www.twitter.com,2022-10-07T16:42:16.000Z,1,Welcome to The Venom Exchange,"Would you like to see adults behave at their most childish and bitter? Do you crave punishment from unseen administrators? Is it reasonable to you that unsanctioned thoughts are unceremoniously swept away? If you answered yes, yes and yes then Twitter sounds like the place for you! Grab your keyboard, pick a comfortingly anonymous username and get ready to do written battle with thousands of strangers. Here's a free starter pack of drone-like phrases to get you underway: • I don't know who needs to hear this, but... • You do know that [your mockingly-toned statement], right? • Am I the only one that... • Repeat after me...",GB
52,www.twitter.com,2022-11-27T16:42:54.000Z,1,Support team very very bad!,"Support team blocking accounts for saying nothing bad and ignoring reports with insults, death wishes and incentive to bet! Just a very bad job!",PT
53,www.twitter.com,2022-08-12T01:50:19.000Z,1,"Tyranny with a political agenda, nothing social about it","Twitter is a website for losers Why? You can't even quote a leaflet from the vaccinations on the eu website or you are blocked for misinformation.  🤣🤣🤣🤣🤣🤣😂😂😂🤣😂🤣😂🤣 Litteraly in on the Europe website for leaflets, then you get banned This is tyranny This is no social platform This is a dictators and anti science pure political platform I hate Twitter for life",BE
54,www.twitter.com,2022-08-06T01:10:23.000Z,1,The worst social network,"In my own experience I see a web with a pretty bad and automated support in every sense, does not give support to your queries, they suspend your account without reason, there is no free speech, and not to mention all the business that hide behind giving favoritism to only a few, even pay for verification, is the social network where the mafia rules, money is only what matters to these people, but not free speech.",PE
55,www.twitter.com,2022-10-05T16:33:22.000Z,1,Twitter is a cesspit.,"Twitter is a cesspit. A vile horrible place where its created and in place to make people argue with one and other. Also its ran by far left lunatics where they ban your account on opinions. I've had my account banned multiple times. First one was on a news report of a man convicted of child molesting. I wrote he should be hanged for that crime. They banned me, saying I was calling for violence...what utter ridiculous nonsense. Second time that got me banned was writing that some people in the TQIA+ mob need mental health support.  Again thats hateful according to Twitter loonies. What a horrible app, here's hoping Musk can change it.",GB
56,www.twitter.com,2022-08-06T19:54:31.000Z,1,I recently joined Twitter and was…,"I recently joined Twitter and was mostly just reading people's tweets. All of a sudden my account was suspended permanently. No reason or explanation was given. I have filed several appeals with no response.  Arbitrary rules, arrogant behavior and no customer service.  Maybe I should be happy not to be on Twitter but the absolute fact of not explaining is just wrong.",US
57,www.twitter.com,2022-08-17T05:13:56.000Z,1,Less than one star if I could,"Less than one star if I could. Their algos pick up key words that are not meant as literal. Anal porn is allowed but tweeting Bed, Bath, and Beyond’s cheap Chinese products should die and collect dust is an offense? OK, deactivated my account and deleted app. Not a big deal, nothing in that platform enriches me or teaches me.",US
58,www.twitter.com,2022-10-17T18:50:51.000Z,1,Twitter is a poor Company.,"Twitter is a poor Company. Activists were stopping Ambulances in London get patients to Hospitals by blocking roads by laying on the floor. I entered a comment on Twitter, Twitter did not like it. ""MY LATE MOTHER REQUIRED AN INTENSIVE CARE AMBULANCE TO TRANSPORT HER A NJMBER OF YEARS AGO TO ANOTHER LONDON HOSPITAL DUE TO A LACK OF INTENSIVE CARE BEDS, SO OF COURSE I WAS ANGRY WHEN I READ PEOPLE WERE COMITTING SUCH RIDICULOUS BEHAVIOUR"" I removed the Tweet and apologised to Twitter. They still permanently suspended my account. Twitter do not understand the word sorry. In life we can all say things in a spur of the moment. VERY POOR COMPANY. Free Speech no longer exists in this world.",GB
