,site,date,stars,title,text,location
0,www.microsoft.com,2023-01-11T15:30:51.000Z,5,Really like the overall experience with the MS Products,"Really like the experience with all the products of the company. Microsoft Edge is working perfectly fine, Microsoft Office is beautiful set of apps to use on daily Baisis, using the Microsoft To Do, which I absolutely enjoy. The One Note application is working as it should be for my working purposes.",UA
1,www.microsoft.com,2023-01-08T21:47:22.000Z,1,Microsoft.com,"Microsoft Office - Support Team is a Big Joke. I purchased office 2016, 2019, and 2021 for my MacBook Pro Computers. If you call their support team you are in for a big surprise. You have to pay $400.+ to speak to someone. Otherwise, communication is via chat, and their experts do not have a clue on how to help. One so-called expert tried to do a screen share and discovered that his software did not work and needed to report it. I blame the CEO at Microsoft for not offering real support.",US
2,www.microsoft.com,2023-01-05T22:19:50.000Z,1,Double Trouble x2,"Double dreadful service with Windows products on new ASUS computers. Windows 11 needs updating with version 22H2, but it does not function even via Microsoft.   There are numerous reports on Microsoft website to that effect. How can Microsoft behave so disreputably?",GB
3,www.microsoft.com,2023-01-06T05:53:11.000Z,1,Slow and disdainful support,"Had been using their reward program for years, saving up points. When I tried to redeem something, I'm suddenly banned. Funny how when I first started and had few points, I was able to redeem something no problem - but when I have hundreds of dollars worth of points... Contacting support results in a form letter reply  received a week later passing the case to another department. A week after that, they close the case with another form letter claiming I broke one or more of a list of rules. Having reviewed them, I opened another ticket insisting I didn't, and asking for the account to be restored, or for them to at least tell me what I allegedly did wrong. Futile. Same week long delays, same form letters.",US
4,www.microsoft.com,2022-12-23T00:14:59.000Z,1,This is a very bad product and even worse custom experience,"This is a very bad product and even worse custom experience, the OS is getting worse every year. and the website is run by bots that copy and paste answers. there is nothing going on at microsucks these days, all programming and tech supports is outsourced across seas to lowest paid call centers. The product is really getting bad and forced updates are a deliberate spit in the face.",US
5,www.microsoft.com,2022-12-21T06:22:27.000Z,1,horrible,"the rewards function is absolute bull. i have put in my phone number on the phone verification a dozen times over the past few minutes, and not a single text message has come. on top of that, 2fa doesnt even work because it doesnt send text messages to your phone.  microsoft, fguck you.",JP
6,www.microsoft.com,2022-12-19T02:02:50.000Z,1,poor costumer satisfaction,"Trying to buy games from a 360 xbox , is a complete joke as it sent me to the American store when I live in the uk, tried to sort this out them but completely useless as there virtual assistant is well stupid, this happens also on there online website for Windows 10. needs fixing.",GB
7,www.microsoft.com,2022-12-19T18:28:40.000Z,1,EDGE browser=UGH,"The EDGE browser is becoming a nightmare. I was completely unable to click any links at the Sam's Club photo website. Then, I switched to the Opera browser, and EVERYTHING worked. Plus, there is NO help link for Edge problems. UGH.",US
8,www.microsoft.com,2022-12-20T14:50:59.000Z,1,Windows 11 - not fit for purpose!,"My current laptop, I've had now for 19 months, and during the entire time, Microsoft Explorer crashes every few minutes, and each time it does I am unable to use the PC for 4 to 5 minutes each time. Effectively I spend half of my time just looking at the screen waiting to be able to continue typing. I have been trying to get this issue fixed now for 19 months, and the only things Microsoft Support can do is to run a ""scan"" or reinstall the operating system. Each time they do this, it causes huge inconvenience as I have to reinstall everything, and the problem just comes back a few weeks later. Utterly useless and not fit for purpose, IMHO. Oh, and support claims it's a hardware issue, but with no evidence of this other than the assumption that their product is bug free!",GB
9,www.microsoft.com,2022-12-05T15:31:00.000Z,1,Microsoft Home Page,"The news feed and stories on the Microsoft home page is full of low brow hate. Stories about how awful celebrities look without their makeup and so forth, which is really depressing.  You can block certain news feeds but this takes a lot of time and others appear in their place. You don't expect this from a what used to be a 'premium' brand like Microsoft. Bring back Bill Gates!",GB
10,www.microsoft.com,2022-12-09T12:37:53.000Z,1,millennials !!!,"anyone who has used windows 95 and 98 knows what an INTELLIGENT, CONSISTENT and RELIABLE operating system means and after XP added a little spice, then TOTAL DARKNESS, millennials generation of totally imbeciles, make everything seem complicated is precisely the attitude of IMBECILES",IT
11,www.microsoft.com,2022-12-12T07:25:55.000Z,1,Windows 11,Windows 11 The program caused by really stable system to become really ustable.  Complete waste of time. Curious how hard it is to actuall leave a review on Windows 11.  They obviously don't want the truth about this POS getting out.,ES
12,www.microsoft.com,2022-12-04T14:07:33.000Z,1,"Never received the laptop, after 6 months, they refuse to refund","This is how dodgy Microsoft business trades in UK: 1- In May, paid £1625 to Microsoft business for a laptop. 2- Due to delay and unprofessional behaviour of their agent, decided to cancel my order after 2 weeks. 3- Early June requested for refund. 4- After 6 months, Microsoft still refusing to pay back their debt. 5- Took the case to the Small Claim Court and despite the court ordered Microsoft, they should refund my money and pay court fee, still they refuse to pay.",GB
13,www.microsoft.com,2022-12-19T21:22:10.000Z,1,What a piece of trash OS,"What a piece of trash OS, one single update today and now I can't use it. Taskbar is just gone. Going for a new OS as these useless ""developers"" give me no option.",RO
14,www.microsoft.com,2022-12-09T02:52:41.000Z,1,Hiding ads as your top email in Outlook,I Use outlook from microsoft. Since a few days now. They updated it. And now i get ads as the first email i have. So i accidentally click on it. Normaly they would just be around the sides  I use this email adress and program for like before 2010 now. and now suddenly this.  This is really shady business practice. And it hampers my ability to use my email. That i have for years. To disguise a ad as an email and put it on top of the emails you got. It is shady. and should be forbidden by the authorities. Sorry microsoft. But if i now have ever the choice to buy your products or not. I would choose not. I dont want to support such shady and abusive practices.  Desired solution. Keep out of my fricking email and personal stuff. Keep your ads to the right side. where i dont care. You greedy frickers.,NL
15,www.microsoft.com,2022-11-08T15:51:29.000Z,1,No customer support,"Wanted to purchase office. Said something about free mouse offer. But the product was a ""box set"". Everything looks the same apart from these two words, so I didn't notice until after purchase. This means I cannot download the program Want to refund absolutely no way to get refund. DO NOT PURCHASE DIRECT FROM MICROSOFT! No support",AU
16,www.microsoft.com,2022-12-27T10:13:55.000Z,5,This company provides the best…,"This company provides the best software; I used some software, and my experience is the best.",CA
17,www.microsoft.com,2022-12-04T04:22:43.000Z,4,I have contacted Microsoft several…,"I have contacted Microsoft several times about my Microsoft Rewards account getting suspended. The only response I ever get is that I did not follow the terms and conditions. Even though I am in Australia and I am the only person in the household to use Microsoft Rewards. I can not believe that I have told so many people to get Microsoft Edge and use Bing and Microsoft Rewards and the only thing that I received from Microsoft is that my account was suspended because I REDEEMED A FREE GIFT CARD.  Microsoft, this is a complete scam. This is unacceptable. You can not suspend someone's account for just redeeming a free git card which is what Microsoft has promised. Microsoft rewards is a scam. The only thing that I like about Microsoft is their developers program which provides free products.",AU
18,www.microsoft.com,2022-11-16T16:56:52.000Z,1,Can't contact anyone in the UK,"Can't contact anyone in the UK, can't make a formal complaint on the website? Can't talk to anyone in the UK about microsoft365 blocking our website contact forms. I guess I'll use Google products from here on in. #AwfulService",GB
19,www.microsoft.com,2022-10-29T21:15:49.000Z,1,Intentionally removes games from…,"Intentionally removes games from accounts in order to force them to buy the game again, and gain a profit. I spent so long in your support system only for you to tell me i cant get my account back, even after admitting it isnt removed or anything. Not letting me answer security questions or anything.",DK
20,www.microsoft.com,2022-12-17T11:52:24.000Z,5,Best products,"Best products. I would like to appreciate and thank you for the microsoft products, outlook, teams, office, skype etc etc.",IN
21,www.microsoft.com,2022-10-26T03:12:14.000Z,1,I have used microsoft prpduct for…,"I have used microsoft products for decades and lost enormous amounts of important data. I came to conclusion that microsoft is not to be trusted with any of my important information. From blue screens of death to random restarts, to crushes and bugs. Their soft has all the bugs on the surface of this planet!!!",US
22,www.microsoft.com,2022-12-04T01:09:03.000Z,1,Microsoft cannot be trusted,"Microsoft cannot be trusted. They choose how I respond to their articles base on my race. I was applauding by what some would type. Something went wrong apparently, I been flag and cannot comment on articles, but cannot remove news and such from my start menu on my device. There would be a article about a dog and some would be able to type out their sentences and others got something went wrong. This is not a computer error this is a human error. The also flagging people accounts so they won't be able to respond to certain articles is also a human error. Also, can't use certain nick names for identity purpose some people are crazy. Microsoft does not keep their consumers safe. I get none stop spam to the point I can't even find my important emails. They are their consumers to pay extra, but why pay for just ad removal and more space? Where is the security?",US
23,www.microsoft.com,2022-11-12T03:52:03.000Z,1,Microsoft Agents Don’t know enough to help,"Bought Microsoft 365 for business last week. Went to install today. Lost count of the number of agents I spoke with. Spent 5 hours back and forth with agents and “engineers “, non of whom could successfully load their program on my computer even when allowed to view my screen. Eventually they stopped calling me back. If I wasn't already so heavily invested in excel I would have dropped them. After reading a little on the internet started winging it myself deleting old microsoft programs and finally I got it to download. Feel like they should pay me at this point for wasting my day with their polite but not terribly useful customer service agents.",US
24,www.microsoft.com,2022-10-12T14:59:15.000Z,1,Microsoft office keeps getting worse,"I have been using Microsoft office since the early 1990's. I used to love Word and Excel. Over the last few decades Microsoft has managed to ruin these products. Important features used to be right at your fingertips now they are buried in layers of minutia, or worse yet do not even exist at all anymore. I kid you not Microsoft Word was better in 1994 Windows 3.2 than it is now. Why does Microsoft keep going backward? They need a new CEO, and people with common sense to design products.",US
25,www.microsoft.com,2022-11-04T21:34:35.000Z,5,Online and telephone support very good.,"Online and telephone support very good. I bought a laptop to try to get everything online, but my cloud would not sync ( or at least, some part was still in Skydrive).  Put in an enquiry, email reply next day, did not work, promised call, called on time but I did not recognise US number, called back , Tanmoy B was kind and patient, sorted problem despite the reluctance of my old desktop to accept him remoting on, and gave me a few other tips as well. So surprising these days when customer service actually serves the customer well, but occasionally it does.  I've used Microsoft support before, and it does they do actually answer and sort out the problem.",GB
26,www.microsoft.com,2022-11-03T17:47:52.000Z,5,Good support and good apps.,Today my issue with MS ToDo was resolved. I find Microsoft support well. I also like MS ToDo app and Clock app where you can set a focus timer.  Today I changed my mind about Microsoft and I think they are getting better. Thanks.,PL
27,www.microsoft.com,2022-10-04T17:07:33.000Z,1,Microsoft really are the pits,"Microsoft really are the pits. I upgraded my storage from 100gb to 1tb as it was Advertised as AN UPGRADE but these scam artists continued to change me for the 100gb as well. For over a year ..... They told me I should have cancelled the 100gb..... its not an upgrade then ! Taught me a lesson about this company, basically they are ruthless scammers... result is I will cancel all my storage and get a personal cloud and slag Microsoft off for the rest of my life :) Stealth charging customers. Up yours Microsoft",GB
28,www.microsoft.com,2022-10-28T22:13:33.000Z,1,My children tried to login to their…,My children tried to login to their Xbox with the correct password but it does not work for some reason. Every single form that we have filled out to reset it has been said not to have worked. I went into the physical store to be told they cannot do anything not even register a complaint. They gave me a number to call but when you get through the menu it ends up telling you it cannot help with Xbox. We have £100's of games they cannot access and no help at all from Microsoft. Just looked at the ratings on this site. What an appalling company there are. Too big and arrogant to care. That's the problem when you let one company get this big.,GB
29,www.microsoft.com,2022-11-04T06:34:23.000Z,1,I paid $300 for my Xbox and I'm paying…,I paid $300 for my Xbox and I'm paying $20 a month for their gaming membership which isn't bad but the home screen on my Xbox is filled with ads which is unacceptable. It's my Xbox and I pay you greedy people every month,US
30,www.microsoft.com,2022-10-02T14:40:27.000Z,1,Product didn’t arrive and no help from MS,"ordered a laptop and a travel hub; only laptop arrived; when I called MS, and spent 45 minutes on the phone with them they suggested I file a police report??!! the most disappointing and bizarre customer service I have ever come across.  Would have expected from a bucket shop but not from Microsoft.  Very poor.",GB
31,www.microsoft.com,2022-10-26T02:26:44.000Z,5,Microsoft is simply the best,"Microsoft is simply the best. Now the developers seemingly very successfully created a software for phones as well and for example Microsoft Word is easier to use on a phone than on a laptop, what is a miracle, I can do my accountancy with the help of Microsoft Excel on my phone,  what was in the past impossible, storing securely files on Onedrive has been never easier, cleans up the storage, deletes duplicates, all work done instead of me. I have had never issue with Microsoft, Bill Gates is the best developer, a big capacity, a genius and deserves only applause for his phenomenal achievements and honour from everyone. Million stars.",GB
32,www.microsoft.com,2022-09-14T11:40:45.000Z,1,Zero customer support,"Great games,  terrible customer service.  I had an issue with a Game over a year ago and submitted several tickets and it was never even attempted to fix. Im having a game crashing issue and have submitted a ticket a day for c the past 2x weeks and no response.  Was just told by a rep there may be a fix incoming in the future.  They won't help anymore and haven't replied when I asked for a credit on my monthly recurring bill for the game. This is a terrible company",US
33,www.microsoft.com,2022-11-21T16:07:27.000Z,1,I have recently spent a lot of money on…,"I have recently spent a lot of money on a new Microsoft laptop The service to help me has been crap, passed from Poland to India with no resolve.  Very disappointed!",GB
34,www.microsoft.com,2022-10-15T02:28:53.000Z,1,Microsoft broke its own T&Cs,"The company breaks its own Terms & Conditions. I have auto-updates turned off - have had since maybe version 3.1 - in the latest MS update, it anyway deleted all my music library and blamed it on an iTunes problem. The point is, again, I have auto updates turned off. The only answer is that MS used a back door to violate its own T&Cs and delete my music library. Incidentally, I have the cds for most of my trax however it was just easier to have them in mp3 format. Now, I would be on pension before I got them all re-digitized. And, I dont even have the WIN 11, I still use 10 so clearly MS you did this behind users' backs.",CA
35,www.microsoft.com,2022-10-12T08:26:12.000Z,1,The worst computing company ever,"I don't know why they never learn, we thought that problems would end with vista, then windows 8 appears, after a great experience with windows 10 just I don't understand what those people are trying to do?!! at time I wrote this review just updated my win 11 the computer went slow as a sleepy snail, btw I have a powerful 2021 gaming laptop, even my dell latitude e6410 was running win10 faster, honestly If I had enough money I'd switch to Apple products, can you believe 4 days ago I've registered for Microsoft Ignite, the confirmation email went to the junk mail of my outlook account, this company is really a joke!",MA
36,www.microsoft.com,2022-09-02T19:29:24.000Z,1,Worse than Abysmal Support,"Abysmal Support - effectively went through the problem online chat, and then the guy said he would have to escalate it. Then received an email asking me to repeat the problem with screenshots and upload to a site. Did this and tried at least 6 times, and all it says every timeis Failed to Upload File. WAsTED 3 HOURS OF MY TIME TODAY",GB
37,www.microsoft.com,2022-08-24T18:22:43.000Z,1,365 = Zero Help,I overan the deadline to cancel my annual Office365 subscription by a few days. Even though they could see the product had been unused (for a great deal of time) and I explained my mistake it was *100% impossible* for MS to do anything after speaking to (and having to repeat the same details) to 3 different departments. They desperately need to develop some empathy for their customers,GB
38,www.microsoft.com,2022-09-01T16:33:33.000Z,1,Micrsoft Outlook App emails get deleted automatically. It's horrific,"I don't know why but after every 1-2 all my emails get deleted automatically from my Microsoft Outlook app of Android Version. It is now for the 3rd consecutive time. It very disappointing and questionable, specially from a company like Microsoft. Free advice, it better to rectify such a blunder. It's horrific experience.",IN
39,www.microsoft.com,2022-08-22T11:03:16.000Z,1,Absolutely idiotic,"Absolutely idiotic. The language keeps changing to english, even though i litterally removed it from the languages it is supposed to use. Its such a basic thing in a writing program, and a multi billion dollar corporation cant even get it right. It just shows that they are more focused on squeesing money out of people with weird and cryptic subscribtion services instead of actually making the program logical and consistent. What a joke....",DK
40,www.microsoft.com,2022-08-06T19:55:43.000Z,1,I wasted 45 minutes of my life…,"I wasted 45 minutes of my life attempting to link a product key to my account. I was unsuccessful. I was not successful because of how Office was purchased. It is a legitimate key. That part is not in question. Microsoft customer service should mirror what Apple does.  When one is paying a premium for their products, this should not occur. Make the process easy and seamless. Lesson learned.",US
41,www.microsoft.com,2022-08-17T16:25:45.000Z,1,I had the worst experience with…,"I had the worst experience with Microsoft, Mac better, bad operators, no one wanted to help me, is sh!t, do not buy anything from this scamming Organization!!!!  Bill Gates want to stole our information to destroy the virtual world. If u want quality no headache buy an apple product, is expensive but is more better than this sh!t!",RO
42,www.microsoft.com,2022-10-13T14:50:17.000Z,1,We use Windows 10 and Outlook,"We use Windows 10 for business and all of our emails are routed through Windows Outlook. We have found Outlook to be a nightmare and with no help from Microsoft. Draft emails disappear, Signatures disappear and Folders created to store important emails also disappear. As a small but very busy business, these occurances which are not isolated but ongoing are seriously damaging to our effectiveness to work and are costing us time and money. We are not at all happy with the product or the helpline service which admit they don't know why this is happening and can do nothing. All that is suggested is that we change the account password but the damage is already done!",GB
43,www.microsoft.com,2022-11-08T17:07:40.000Z,1,"Atrocious, Non-Existent Customer Support","Microsoft is the perfect example of everything that's wrong with modern day customer support - that is, if you could even call it that. The only support for 365 is online chat to representatives outside the US that don't know anything about Microsoft's products, can't answer basic questions, and have no ability to solve the problem I had. Then when asked for a phone number to call, they give a phone number that forces you down a time-wasting rabbit hole that ultimately tells you ""support has been moved online"". Yep, their offshore support team, who they probably pay slave wages to, is told to provide a US phone number that just tells consumers they don't have phone support in the US. Microsoft is basically telling their consumers - ""You get what you get. If you have any questions or issues, F off.""",US
44,www.microsoft.com,2022-08-08T22:03:05.000Z,1,MICROSOFT USELESS SUPPORT,I bought a Dell laptop from Microsoft. When updating to Windows new version it crashed. I called Microsoft through a backdoor because they wouldn't help. The service told me that I needed another windows laptop to fix the one I had. Microsoft is the most useless company I have ever dealt with. Don't buy anything from them. Send a message.Buy a Chromebook.,CA
45,www.microsoft.com,2022-08-04T16:45:55.000Z,1,I am the owner of a Microsoft Surface…,I am the owner of a Microsoft Surface Book.  Turns out the Surface Book is a piece of junk.  Keys are falling off and functionality is diminishing.  No surprise then that it is no longer being sold.  I had Assure for 24/7 phone support.  Turns out that was cancelled even while I was still paying for it.  Unscrupulous.  Unconscionable conduct.  May your share price plummet to reflect how badly you treat people who have bought your products.  Evil deception has no place in customer service!,AU
46,www.microsoft.com,2022-09-29T02:21:27.000Z,2,MicroShaft,"It seems that almost every Microsoft Windows 10 update breaks something on my PCs. The last one resulted in two issues: PC1: pin is no longer recognized by Microsoft, so I cannot log into my PC. The link provided in the message does not work. Thank you Microsoft. PC2: I have a message that I need to register my Windows 10 software. That has been done at least twice in the past. Thank you Microsoft. Why, oh Why didn't I buy a Mac instead of a Windows based PC? I knew better, but I didn't want to spend the extra money. I did not take into consideration the many hours I have spent resolving the problems caused by MS untested updates. Shame on me!",US
47,www.microsoft.com,2022-07-28T14:09:33.000Z,1,business customers is unacceptable,Microsoft is a great company and I like the products but support for business customers is not up to standard. My company 365 service has been stopped since yesterday and I have 40 employees that cannot work. I have tried to speak with UK customer service but after 2 hours no reply!!! completely unacceptable.,GB
