,site,date,stars,title,text,location
256,www.microsoft.com,2016-03-30T01:30:34.000Z,1,"Privacy invasive, exposes customer to unnecessary risks","I work with people to improve the safety of their routine digital lives.  It is shocking to me that the biggest player in that space actively forces customers to expose themselves to many unnecessary risks and not only compels needlessly sweeping invasions of privacy but is bluntly unapologetic about it.   Please consider these facts:   With the release of Windows 10 Microsoft entered a new phase in which it forces all customers to maintain a literal 24-7, 365-days-a-year connection to Microsoft servers, without any explanation.  The pretend-reasons offered by Microsoft supporters in their ""Answers Community"" are demonstrably false and Microsoft has been arrogantly unwilling to even acknowledged customers have a right to be informed about what is being done to them, on their own private property.   The answers include things like the need for updates to the operating system or the various unsolicited programs Microsoft installs that are not part of the OS. The fact is that disabling everything that has been publicly identified as functional reasons for the uninterrupted umbilical cord does not result in the cutting of that cord.   There are ways to forcibly prevent these connections but they are well beyond the reach of the typical user. What is proven is that stopping the connection causes no impairment at all to the functioning of the OS. So it is clearly an unnecessary connection.   But the imposed fulltime connections are only one way Microsoft is abusing its customers. It is also forcing them to maintain an attack surface that exposes them to unpredictable vulnerabilities by third party bad actors. Set aside the objectionable attitude that, once you install a Microsoft product, you have transferred ownership of your device and effectively your digital life to them, and instead consider bad actors who are not Microsoft.   A very important good hygiene practice is to not keep code on a device that is not used. So if you do not use a game, let's say ""Candy Crush,"" then it should be removed from the device.  The reason this is important is that every line of code on a device presents an opportunity for hackers to find exploits. Think of it this way: if you were forced to live in a neighbourhood where rocks were constantly and randomly being thrown at your house, you would not install a bunch of extra windows. You might even board up the windows on the main floor in the hope you could limit exposure to one or two upstairs.   Microsoft not only does not follow this basic principle of reducing the attack surface, it forcibly prevents customers from doing so themselves.   Worse, it actively and wilfully deceives customers about the state of their device. When a customer uses the uninstall procedures established by Microsoft - when it allows uninstallation at all -- it is reasonable for that customer to believe they have actually uninstalled that software. But Microsoft does not uninstall lots of software it tells you has been uninstalled. It keeps on your device, sometimes in part and sometimes entirely, the code for the ""uninstalled"" software, exposing attack surfaces you not only cannot defend, but have no way of knowing exist.   I have gone into some detail on these examples for the purpose of demonstrating the bad review is not only reasonable, it is compelling. There are many other instances where Microsoft actively compromises the state of customer devices to serve Microsoft's interests and to h*ll with the interests of the customer.  Sometimes they even admit they are installing problematic code, as in the case of their browser, ""Edge.""  Remarkably, in response to customer complaints that Edge discards the settings they make to reduce surveillance of their internet activity, Microsoft says that it is a factor of ""development"" software and ""everyone has been made aware"" that Edge is not a finished product. They use the broken state of their own product as an excuse for the abuse that product is working against customers. And they completely fail to have any sense of propriety regarding the ethics of forcing customers to have installed defective software -- because there is no way to uninstall Edge.   We should all be appalled that regulators allow this behavior, this rank and brazen abuse of customers by a corporate player who engages in the abuse simply because they can. Their software has become essential to the digital ecosystem and in being essential gives Microsoft license to engage in risky behavior and practice an abusive culture that no other business would be permitted.   So a bad rating?  It borders on the criminal given the outright deception employed. Bad is too kind.   --- NOTE IN RESPONSE TO MS RESPONSE ---   Microsoft's response is simply not true. It is demonstrably false and they know it is false.   There is no setting regarding Updates or *any* *other* configurable setting of Windows 10 that will stop the 24-7 connection to Microsoft servers.  I have personally challenged Microsoft on this deceptive answer in their own ""answers"" community and they have shifted to other equally demonstrably false explanations.   To be clear, I am prepared to provide my personal details to Microsoft so they may file suit against me for libel when I say that they are knowingly lying to customers when they provide these explanations that can be shown in any court to be false. What is truly bizarre and evidence of the utter contempt with which Microsoft regards its customers is the fact that they must realize it is not a difficult lie for anyone with a moderate amount of technical interest to confirm for themselves.It is a simple matter of acting on each of their successive cover stories, starting traditionally with this one, the ""updates excuse,"" and testing after each whether or not the permanent connection to MS servers stops. It does not.   Moreover, even if a reasonable person accepted the declarations at face value, it would make MS practices no less hostile. The updates system does not require a full time connection. It requires a periodic check to see if any updates exist and, if as in 29 days out of 30, there are no updates, the connection can be closed.  Almost every other software vendor in the world, including those explicitly involved in security such as Symantec, McAffee, Kasperski and all of them, operate update systems in this sensible way. Only Microsoft tries to use it as cover for one of its tools effectively taking ownership of your device.   Please also note that in their response MS acknowledges that Edge is in development. Given that fact it is offensive that customers are unable to remove it from their systems.",US
257,www.microsoft.com,2016-03-27T16:18:59.000Z,1,Biggest Rip Off Ever!,Honestly can YOU say you have NEVER had problems with their software!?,GB
258,www.microsoft.com,2016-11-14T16:49:57.000Z,1,MALWARE,"Microsoft is forcing me to take W10 after I tried it and it crashed my computer 3 times and rendered my in-machine search facility invalid.  Who took over that control?  I then spent two days and money to have my PC wiped clean and re-instated W7. Microsoft owes me for this.  Now I am trying to keep away from their nightmare Windows10, but constantly they are pushing it down my throat by devious stealth methods, by hidden secret downloads I cannot remove and again, my search facility is becoming impaired.  Then their chap plays silly games and wants to take over my PC to interfere with it.  Microsoft had become a law to itself, interfering with people's property and violating people's wishes.  If they want to persuade someone that they have a clean intent, they will have a job!  Bill Gates owes me three crashes, one complete loss of memory and one partial loss of memory.  I would advise him to leave my PC alone and not trying to take over my life.   Hope someone else takes over and Microsoft goes down the drains where it now belongs. If all of this was not bad enough, their reply on Trust Pilot does not touch on any of the issues raised, which means that they have nothing to say to excuse themselves.  The solution is to stop all updates from Microsoft, but keep your antivirus and firewall up-to-date.  Microsoft had become for all intent and purpose a MALWARE.",GB
259,www.microsoft.com,2016-03-18T11:22:24.000Z,1,Because Windows 10....,Watch as a company makes horrible and unstable software and then forces millions to use it.,US
260,www.microsoft.com,2016-02-26T14:22:45.000Z,1,Total lack of support,"Have had issue with the Microsoft headset. Long story short: there is nothing they can do about it even there is valid warranty. Nobody knows nothing, just offers to contact some different department. Shame on Microsoft, your support is invalid. Though I cannot imagine what support people are getting with serious issues, when they've invested money in expensive MS products.",GB
261,www.microsoft.com,2016-02-19T16:50:57.849Z,1,Terrible support,I purchased a keyboard from amazon. couldn't get it to work so i phoned Microsoft for technical support. to which they replied i need to contact amazon. all i want to now is if i am doing something wrong! power is getting to the keyboard and only a few button work.,GB
262,www.microsoft.com,2016-01-30T05:40:27.692Z,5,Genuine,"They have made some genuine mobile phones. I use this brand since 2 years. Never have any issue with camera, touch, battery e.t.c. Really happy with this device.",GB
263,www.microsoft.com,2016-01-28T14:25:05.205Z,5,lumia 535,"I've this phone since December, running windows 8.1 mobile, and no problems. This phone is nice no hanging and i am also played game which size around 2 GB no hanging no touch problem.",US
264,www.microsoft.com,2016-01-25T17:23:46.000Z,1,Scandal!!,"From this day i am 100% positive that i will NEVER EVER buy any microsoft product again.   Such lousy service. Wanted to upgrade my win 10, but the update crashed my computer totally, and no help from you guys.   Then after some 40-50 minutes on the phone ,the service lady said ""why can't you buy a new computer? ""     That's just unprofessional!!!!",DK
265,www.microsoft.com,2016-01-19T17:29:36.000Z,1,Unreliable online upgrade service and totally appalling customer/tech support!,"Got a Windows 10 home laptop which I wanted to upgrade to Windows 10 Pro. I via Microsoft Store as offered and from there purchased my £99.99 upgrade. It then offered me to do the upgrade by simply clicking on an upgrade button. So far all went well and it was completed within minutes, but then after the reboot and login back on I got the quickly displayed button that it couldn't upgrade my Windows edition, to try again or contact support. I tried about 5 times, looked throught the event logs to get an idea as to what the problem is but nothing to give me an explanation. So I decided to contact MS customer service/tech support and that's where it went from bad to worse. I think I spoke to 7 different people, with a different level of English so explaining what the problem was and to have them understand was quite a challenge in itself. Anyway, it got me nowhere as nobody could help and on both occasions I called, the line was dropped. How unhelpful and useless is that ! So now I have paid for an upgrade, I only been provided with an Email containing an Order Number but no Windows 10 Pro license key, and a Microsoft Customer Service/Support incapable to resolve this issue.   As a consumer and IT Professional I find this totally and utterly unacceptable from a company who's trying to pride itself as a world class customer service. This is shambolic service !   Never again and I will go for a refund....",GB
266,www.microsoft.com,2016-01-07T13:07:27.288Z,5,Microsoft Fit Band 1. Love it,"Was bought a Microsoft Fit band 1 for Christmas and its great. Cannot fault it.   It keeps accurate data about my sleep and my fitness and heart rate. The Sleep part has bern extra important to me as i have always been curious being on a lot of medication on how many times if any I wake up and how long it takes for my meds to knock me to sleep.   Anyway I would Highly recommend this product. When the Microsoft Fit band 2 comes down in price il purchase that as its more rounded for your wrist as apposed to the square on the 1st.",GB
267,www.microsoft.com,2016-04-13T14:52:24.971Z,1,Terrible company with woeful customer service,"I recently bought a laptop from the Microsoft Store. It was advertised as of a certain specification, and suitable for upgrade to Windows 10.   When it arrived it transpired it was of a lower specification than advertised.   I tried to upgrade it to Windows 10 and failed.   I called Microsoft customer service and was staggered by their rudeness and ineptitude. One ""manager"" in particular, Jonathan Fleischmann, was especially rude, and especially inept.   It would take too long to list the failings of Jonathan Fleishmann and his colleagues at Microsoft, but in summary I was laughed at for thinking the laptop could run Windows 10 despite pointing out that Microsoft's own store website advertised it as such, I was given a massive run-around whilst trying to solve the problem (being asked to call telephone numbers in the USA despite living in the UK for example), and found that Microsoft (which calls itself a ""multinational technology company"") cannot be contacted by email.   Dealing with the company felt like banging one's head against a huge, very stupid, very condescending brick wall, and it became clear that Microsoft really do not care about their customers in the slightest.   All in all, my experience of Microsoft left me incredulous - I cannot believe a company still exists that has such backward customer service, especially one this size. I cannot imagine it will last for much longer without massive massive change.   EDIT: In response to Microsoft's reply below - Look at the top of the page - this is for reviews of Microsoft.com. That you have registered that microsoft.com is based in Denmark is Microsoft's mistake, not mine.   And telling me to go somewhere else for advice is either dumb, deceitful, or both. As you'd see, had you read the review, I've made contact with Microsoft on a number of occasions and everyone I've dealt with has been uniformly useless.   EDIT: I see now that they've changed the name of the company associated with the website address ""microsoft.com"" from ""Microsoft"" to ""Microsoft Danmark"".   So typical of Microsoft - rather than address their failings, they just make it harder for people to highlight how rubbish they are.",GB
268,www.microsoft.com,2016-01-27T10:19:36.816Z,1,"False promises, no follow up- impossible to contact correct department","I used Microsoft's website to alert them to a retailer, who sold me counterfeit software (Office 2013 Pro). Microsoft had me fill out forms with all the details and asked me to post to them the hard copies of the invoice and everything the retailer supplied me with. They promised they would get back to me and, for my effort (and the fact I had paid good money to someone posing as a certified retailer) they would give me a complimentary version of the program. They promised to get back to me but never did, no contact details were provided and no customer agent knows of a way of contacting the department. I filled out the online form again and the same thing happened.  After all this I am left without functioning software (I was given a key that only worked once by the rogue retailer, not 3 times) and no way of following up. Bad business Microsoft!   UPDATE 27/01/2016 Since this is the only way to 'contact' Kristina from Microsoft in Denmark (it would be helpful to have had an email address to reply to the question posed in response to my complaint), here are the details of the report : Ref: 1BH8-V72F. I still haven't heard back and it has been 13 weeks",GB
269,www.microsoft.com,2015-11-27T11:07:40.000Z,1,"They broke my Surface pro 3 screen, are ignoring me and are RUDE.","So my Surface Pro 3 developed some problems. Screen suffered from some lighting bleed, the machine was badly overheating and it was running very slow.   After a short chat with their customer services I decided to send the machine in for a repair.  And this is when the trouble started!!!!!!!   Microsoft were not updating me on the status of my repair, their support staff could not tell me what was happening and on many occasions have given me false information. After complaining I received an email from UPS that the package was sent. Four days later I receive my machine back.   The machine I sent back was not inspected and, worst of all, it had a massive crack on the screen. Looking at the package it was obvious that the machine was badly packaged. It was sent in a padded enveloped and stuffed inside a weak box that had no protection.    It is very careless of them as not only did they not repair my machine they were now responsible for actually damaging it even more, rendering it completely useless. So, I complained via email, via their chart function, via phone and it was leading nowhere. Their staff showed very bad attitude which was rather shocking. Finally one of their chat support staff told me that within 24 hours someone will contact me with some resolution. Two hours later I received shipping labels and nothing else. I was not sure what was happening so I called their support line. This member of staff called “Nathan” had no idea what was happening and was struggling to find me on their system. Some time later he does find me and when I asked him who sent the labels and when will I hear back from the escalation team regarding my issues.  He said he was not sure and that I should send me broken Surface back then. I asked about my complaint and he then said that because I received the shipping labels this was it. Everything has been resolved. I then asked to speak to his manager and he then told me that his manager would not want to speak to me as this issue has been resolved. The man was very rude and at the end I had to stop the conversation. So at the end of all this Microsoft has left me at the considerate loss and has demonstrated unacceptable customer service.    Going forward I will not be buying anything off these people again and will now sadly have to consider buying Apple products.   AVOID THEM   I will update this review as things happen.    Update - 24/11/2015    Today I confronted their chat reps about what their colleague told me the day before. Yesterday one of the chat support staff told me that someone will be in touch from the resolution team. He told me that within the 24 hours someone will contact me.   30 minutes later this rep admitted that previous rep made up the 24 hours claim. He told me that there was no way for them to know when this will be sorted out. So in essence they lied again.   Update - 27/11/2015    Yesterday I finally spoke to someone from Microsoft. A very polite man who promised to get back to me today, after he looks into the case. At around 2 in the morning I received an email from Microsoft telling me that they are posting me my SP3 machine back. The email list the same serial as my old SP3 so I guess that again they did nothing and are posting it back (probably this time with the whole screen cracked). I am now waiting for a call back from Microsoft. Will update this review again in few days.",US
270,www.microsoft.com,2015-11-20T17:21:31.000Z,1,HORRENDOUS,"I tried to install office 365 today and had an issue so I spoke with the Microsoft support desk as I am not so IT minded  - this has been one of the worst experiences I have had regarding IT support of any nature - no one knows what they are doing - and they pass you onto other people who also have no knowledge of what is occurring - I think the worse is when a gentleman with an Asian accent picking up the phone and telling me his name is Chuck Norris and doing it with an American accent whilst giggling on the phone took the biscuit (funny now when I read it but infuriating when I am having so many issues).  I was then informed that they could not give me any help due to the fact that I had asked for a trial period first so had to go via a forum - One of the main reasons why I am having to install office 365 is that I want to use drop box on line which apparently now you have to have a 365 account to do so which I find very unethical to say the least.  Dear Caroline - I have now tried again to install 365 only because I need it for my business I spoke with two people who were fantastic and then I had to be put through to technical support  who told me that it would take 15 mins waiting time which I was prepared to wait for but 45 mins later the line went dead - my service number is 1314011177  This was put down as an urgent request !!!!!!!!!  Please could you update me on how I can resolve my issue ......................",GB
271,www.microsoft.com,2015-11-07T21:25:20.074Z,4,Windows 7 - the best so far,All that fuss about 8 and 10 is overrated. Never liked anything except for 7,US
272,www.microsoft.com,2015-11-03T23:00:15.948Z,4,WINDOWS 10,"LIKING IT A LOT. SO MUCH TO EXPLORE AND GET TO KNOW WITH THIS NEW SYSTEM. UPGRADED FROM 8.1 WITH TREPIDATION AND I WAS PLEASANTLY SURPRISED.  WINDOWS 10 HAS NEW SURPRISES RE THIS WIN 10. APPS INTEGRATE VERY WELL TOGETHER SOME NEW AND SOME FAMILIAR.   THERE WILL BE FURTHER UPDATES HOPE IT CONTINUES AS IT HAS BEGUN, UPWARDS AND ONWARDS.   I CAN DEFINATLY SAY I AM A LOVER OF WINDOWS 7 AND MICROSOFT HAVE DONE A GOOD COMPROMISE BETWEEN NEW AND THE OLDER PLATFORM. I LIKE THE START MENU WHERE YOU CAN KEEP THE TILES, THE VIRTUAL DESKTOPS, SCREENSHOOT ETC ETC ETC...   THIS IS THE START OF STILL LOVING WIN. 7 BUT NOW WIN. 10 CAN BE INCLUDED. I'M REALLY ENJOYING 10. MAY IT CONTINUE.",GB
273,www.microsoft.com,2015-11-17T16:42:49.617Z,1,Sadly My Microsoft Office 365 is Inferior to 2010 Version,"My Office 2010 worked fine. I was forced to upgrade to 365. This worked fine until I made the mistake of signing into Skype and was ended up using the online connected version of Excel. I have since found out how to get back to the local version of Office 365. However, I still cannot get my local version of Excel to work as well as previously. Downloads from Google can't be loaded directly into Excel. The formatting of cells no longer works. Etc. I'm stuck with 10 months of a 12 month contract on a product that just doesn't work as well as the previous version. I would have been better using a free version of Google.",GB
274,www.microsoft.com,2015-10-24T22:39:53.695Z,4,"Expecting bad tech support, was very pleasantly surprised","I recently upgraded my laptop from Windows 8.1 to Windows 10.  After waiting a solid 6 weeks for the silly ""Get Windows 10"" to decide they were ready, I just downloaded the upgrade directly from the microsoft website.   I wanted to do a clean fresh install of Windows 10, however you MUST upgrade first before doing a clean install.  I followed these instructions, upgraded to 10 and made sure it was activated.  I then formatted my computer and did a fresh install of Windows 10... which wouldn't activate.   After a little internet research, some people say the system would auto activate after 24-48 hours.  No Luck. Windows 10 treats itself as an OEM install - as long as you have a valid activated copy of 7, 8 or 8.1, you can upgrade to 10 and it will give your computer a generic activation key that is actually generated by the unique hardware (motherboard, harddrive, etc) that your computer contains.   After the clean install, I had the error code 0xc004c003 which means the system wouldn't accept the key that windows 10 GAVE ITSELF after upgrading.  I followed all the steps as required on the Microsoft website.   With a sinking feeling, I decided to contact microsoft tech support directly.  I explained my problem and they immediately transferred me over to the activation specialists (... or whatever they're called.)  Sounds like this is a common problem.   Explained the issue to the second tech, and he requested remote access to my computer.  I granted the request - research had said this was the most common way to get activation issues dealt with.   After about 20 mins of what seemed like nothing happening (occasional mouse movements, but obviously he was doing something on the back end that I couldn't see) he added a second tech to the remote control.  They quickly changed the product key and boom, activated, no problem.   I was expecting a horror story of being told to roll back to 8.1 and then do a clean install all over again, but 25 mins out of my day and they had it fixed without any arguments or questions.   That was a pleasant surprise, and I would say that although it seemed like they weren't doing anything for a long time, it worked out and I am happy.  Yes, the waiting around with no apparent work on my machine was disconcerting (did we lose connection? did they forget about me?), but a little bit of patience was worth it.",CA
