,site,date,stars,title,text,location
673,www.twitter.com,2020-12-21T13:38:37.000Z,1,If you love America and want to use…,If you love America and want to use your 1st amendment rights to express your love for your country This company will suspend your account to oppress your rights.,US
674,www.twitter.com,2020-12-14T01:51:02.000Z,1,Terrible censorshop algorithm bans and…,"Terrible censorshop algorithm bans and supresses things that aren't even controversial. Moronic company losing popularity by the second. They demand a phone number, too, to screw with your privacy.",CA
675,www.twitter.com,2020-12-13T23:38:39.000Z,1,The reason for my rate is I use to like…,The reason for my rate is I use to like using twitter until they suspended my account @KevinTerribly back in March by mistake because it was hacked from an iphone posting things I was having to delete myself that person was posting while I wasn't using twitter at the time then they were doing other things I didn't know about plus I've been filling out the support form for something that shouldn't have happened in the first place since my account was suspended because of that person who hacked my account I can log into still. On the other hand never got back to me on my new twitter account through support either but never got an e-mail back from them for help with my issue and they could fix this.,US
676,www.twitter.com,2020-12-13T01:00:00.000Z,1,Censorship and Oppression,"Censorship and Oppression, that sums it up. Never give up!! Right will win.",US
677,www.twitter.com,2020-12-12T16:47:10.000Z,4,Twitter Navigation,"Twitter is one of the leading social media platforms in the world, and I see why; it's informative, full of content, active and widely available therefore the community is huge meaning there is always someone to interact with.  The navigation around the site isn't as self explanatory as some others, this may be as it is very full, whereas other websites stick to a more simple dashboard.  Also sometimes I find it hard to find content I am looking for as there is so much it's hard to filter for what you're really looking for. Another thing to bear in mind is that every post you like, comment or retweet will show up on your profile page, this can be a negative aspect of the site to some.  Overall Twitter has many benefits, hence it's tremendous success, it can seem overwhelming to beginners however you will get used to it if you spend time getting to know it.",GB
678,www.twitter.com,2020-12-12T02:43:48.000Z,1,wit a load of s**t*,"wit a load of s**t*. A good hour spent trying to change my password, but naw the c*nts don’t recognise my user name or email, though send me an email to reset my password????? One comment I wanted and you fu**ed it for me. Never again will I try with this s**te, stic* it right up you cun*s",GB
679,www.twitter.com,2020-12-12T02:31:07.000Z,1,MY ACCOUNT shows suspended account…,MY ACCOUNT shows suspended account without a reason  I'm  not a Trump ass kisser so that's probably the reason. I just speak the truth. Twitter is a Communist platform and I want no part of their NAZI scheme. May they kiss Trumps ass until they are covered in orange feces.,US
680,www.twitter.com,2020-12-11T14:08:32.000Z,1,Twitter has become BIG BROTHER,"Twitter has become BIG BROTHER, censorship has got out of hand, it's hardly social media",GB
681,www.twitter.com,2020-12-09T19:54:32.000Z,1,Crappy Platform!,"All Twitter is is people complaining and hating about everything and everyone! And to top it off, Twitter censors and blocks anything relating to Conservatives or Trump! So biased!!!!!!",US
682,www.twitter.com,2020-12-05T02:53:06.000Z,1,Twitter completely sucks,"Twitter completely sucks, they are way too left wing. There days are numbered, Parler is taking over.",US
683,www.twitter.com,2020-12-03T17:19:01.000Z,1,Worst customer support service I have…,Worst customer support service I have ever experienced,ES
684,www.twitter.com,2020-12-02T22:46:37.000Z,1,Actually horrible platform,"Actually horrible platform, so censored, I was just talking about my views, not in an aggressive way at all, was just having a conversation, and I get locked out TWICE, and they ask me for my phone number otherwise I can't get back in, and now I can't even delete my account, I HATE TWITTER. Go over to Gab or Parlour or MeWe.",GB
685,www.twitter.com,2020-12-02T20:34:43.000Z,2,Well deserved,The kind of spam they get on these comments here is the same kind of rampant garbage they permit on their platform. Taste of your own medicine.,DE
686,www.twitter.com,2020-11-30T13:58:48.000Z,1,Very truly Unfair,"Unfair, anti American, bias and fake news. I deleted their app because of unfair censorship to conservatives. They need to be regulated and all protections remove. Now I use Parler that is much better than lame Twitter.",US
687,www.twitter.com,2020-11-29T20:35:09.000Z,1,Government Censorship Through Private Corps,"Since the US government cannot constitutionally censor dissidents thanks to the Bill of Rights, they do so through ""private"" corporations like Twitter. Over the years, I have collected numerous screenshots of Twitter censorship in action and a company blacklist was even discovered by hackers. Look it up. Whether you criticize illegals wars, occupations, war criminals, make jokes, expose war crimes, or even create parodies of criminals like Jeffrey Epstein, the Twitter team will be there to censor you on the spot using various methods whether banning a search of your name, hiding your replies, or simply deleting your account without any warning or explanations. Twitter also collects phone numbers to blacklist people so if you try signing up again, you will find yourself automatically blacklisted. Basically if you don't go along with whatever the government does, especially foreign policy, you'll find Twitter putting up walls all around you to put you in your own echo chamber and eventually purging you.",TR
688,www.twitter.com,2020-11-29T09:31:34.000Z,5,Best for share news.,"Date of experience:   November 29, 2020",MA
689,www.twitter.com,2020-11-29T09:23:16.000Z,1,fools love twitter's totalitarianism,"If you are a fan of North Korea, or have been employed by the KGB you will adore this anti-American platform. time to REVOKE twitter's Section 230 status.",US
690,www.twitter.com,2020-11-29T00:24:34.000Z,1,One of the worst social medias ever,"The limitation of 280 characters makes the website just a ton of pointless informational garbage. Since retweets are the only way how posts get viral, the majority of popular tweets are always something emotional or something that teaches you ""who is bad and who is good"". Simply tweets get viral when many tweeter users live in the same imaginary world. Don't waste your time, avoid the website, you will lose absolutely nothing.",UA
691,www.twitter.com,2020-11-26T19:07:28.000Z,1,Twitters socialist agenda and continued…,"Twitters socialist agenda and continued censorship must stop.  Criminal behavior should and will be prosecuted. Wait for those lawsuits, they are coming.  Your stupidity is there for the world to see.  If you do not like the USA...leave.  We will not lose our freedom, our rights and what we’ve fought so hard to preserve.  I’ll drink to the demise of your company and your truly f***ed up vision for this great country.",US
692,www.twitter.com,2020-11-26T09:42:19.000Z,1,"When they're good they're good, when they're BAD they're VERY BAD","I have been using Twitter for personal use for quite a few years and have been rather dis-satisfied with the ""service"". When a ""service"" is unreliable, cannot be sorted out when things go wrong, and when Support staff are totally unreachable - it is not a ""service"" it is a hindrance.  I WOULD NEVER USE TWITTER FOR BUSINESS PURPOSES – IT IS TOO UNRELIABLE. I have several personal accounts and for the past week I have been unable to Tweet.  This has occurred several times now. When I send a Tweet, I see the message ""Your Tweet was sent"" - but in fact it hasn't. The Tweet appears on my Timeline - but does not appear on the destination Timeline. VERY DECEIVING. I know that the Tweet has NOT been sent because I am able to check using another account. It seems that quite often I find my accounts have been severely restricted rendering them unusable. And what is worse, I discover that my more recent Tweets have been deleted. I am not aware of any reason why my accounts have been restricted. I am not given a reason by Twitter why they have been restricted. I don't even know if they have been deliberately restricted by Twitter or if it is a system bug. If you want evidence of my claim, just look at more of these reviews on Trustpilot, even better, look at the “@Twittersupport” page on Twitter itself. Finally I repeat, don’t rely on Twitter for a Business.",GB
693,www.twitter.com,2020-11-24T07:39:32.000Z,1,Twitter harms businesses,Twitter harms businesses and is based on fraud and deception. Do you actually think buying followers cannot be stopped by twitter? See Twittercontact.com for more details.,US
694,www.twitter.com,2020-11-24T05:21:25.000Z,1,This company shouldn't exist together…,"This company shouldn't exist together with Facebook I hope someday both company get close, both are part of the elite, both are comunist",US
695,www.twitter.com,2020-11-23T23:36:16.000Z,1,"Like the other ""social network"" sites…","Like the other ""social network"" sites (see Facebook) this site is run by communist dictators who believe that their farts smell like strawberries. Unlike their competitors (who more like herpes) you can cure yourself of Twitter, you can easily walk away from this mire of douchebags and self important ""Libtards.""  Take it from someone who was on Twitter, until I voluntarily deleted my account - I immediately felt 60% better about myself. Stay away from this seeping boil on the internet - open a Parler account instead. You'll be glad you did.",CA
696,www.twitter.com,2020-11-22T21:09:51.000Z,3,it's ok,"it's ok. it's great for content creators to stay connected, among getting new topics to talk about. Tho sometimes, the tweets makes you lose a lot of braincells fr.",DK
697,www.twitter.com,2020-11-21T21:37:52.000Z,1,Not a free speech zone,Not a free speech zone. Twitter censors your tweets if you do not agree with twitters political views. I have deregistered my account with twitter and moved to Parler who supports free speech.,AU
698,www.twitter.com,2020-11-21T16:41:33.000Z,4,Good app,"Good app, dont know why they added stories though",GB
699,www.twitter.com,2020-11-21T03:46:41.000Z,1,Screwed up in the head social media is,"Screwed up in the head social media is,  along with Facebook etc certain ppl can say certain things but others can't...",US
700,www.twitter.com,2020-11-21T00:24:49.000Z,1,Worst social media platform ever after…,"Worst social media platform ever after Facebook. Full of lies, people talking crap all the time. Won't see me using it ever again. And now they want more of your ID. Screw U",AU
701,www.twitter.com,2020-11-20T06:19:12.000Z,1,Twitter is the worst company,"Twitter is the worst company, who ever said they are a great company is because they are butt kissers. Twitter sensor all types of wording, even when it is harmless to another. You don't have any freedom of speech at all. It is a disgrace to the American people, and Twitter is a company who sole purpose is to freeze or lock accounts that have NOT violated any rules, or regulations of any kind. It is uncalled for, that they only will allow content they only agree on. If it is not what they believe to be true, they will lock up your account. The same goes for facebook. It is a dictatorship of a company, that shows no bias of what is true or lies. They allow brain washing of there users to stay on, while freezing of accounts who speak the truth. Go ahead Twitter keep it up, and eventually thoes who see the lies will leave you as well. My paranormal team will not be back. I would rather pass out fliers door to door to get my audience, then ever go back to you. You couldn't pay me money to come back! Don't try to sweet talk me, to come back. Its not happening.  Trump 2020. MAGA! Skywatch paranormal of Michigan.",US
702,www.twitter.com,2020-11-20T00:56:27.000Z,5,Literally amazing disregard those…,Literally amazing disregard those negative reviews cos Twitter is literally the best I love Stan twitter and drama twitter and Fiat 500 twitter,GB
703,www.twitter.com,2020-11-19T05:47:48.000Z,1,The worst of the tech companies,The worst of the tech companies. Am deleting my accounts. Pushing your politics on your consumers. Will not be back. #Trump2020,US
704,www.twitter.com,2020-11-18T13:15:39.000Z,2,Downwards spiral,"Twitter used to be a good platform to use, until they kept adding ridiculous ""protections"" to it as a way to censor people while letting bots run rampant. Disgusting.",NL
705,www.twitter.com,2020-11-18T12:15:46.000Z,1,As I see what Twitter is,"As I see what Twitter is. I hate it. If pple get removed for stupidity,  why is Trump still abusing the rules and stay on? He's a nobody above anyone else who uses. He goes overboard on Twitter all day and night and thats ok to do is raising more problems with our country being attacked by following hate. Twitter needs to be taken off!!",US
706,www.twitter.com,2020-11-17T22:26:13.000Z,1,They seem to favour paedophilia over…,"They seem to favour paedophilia over truth and facts and no matter who you are, that is not a good thing...at all.  A corrupt and vile platform run by those pushing the current agenda.  Get it gone.",GB
707,www.twitter.com,2020-11-17T19:08:16.000Z,1,I invalid was banned and I was not able…,"I invalid was banned and I was not able have my account.I have stenosis but I haveca heart and soul too.I am human,not because not vip I must block everyone",IT
708,www.twitter.com,2020-11-17T16:09:36.000Z,1,Twitter censorship is out of control,Twitter censorship is out of control. They censor anything that they feel goes against their very liberal agenda. We should all switch to a platform that supports free speech and not a personal agendas.,US
709,www.twitter.com,2020-11-17T11:52:07.000Z,1,Trenton Kennedy is a despicable human…,"Trenton Kennedy is a despicable human being and needs to be fired from twitter's poor excuse for a ""communications"" team as soon as possible.",GB
710,www.twitter.com,2020-11-16T22:31:51.000Z,1,Twitter censorship is out of control,Twitter censorship is out of control.  They censor anything that they feel goes against their very liberal agenda.  I’m switching to a platform that supports free speech.,US
711,www.twitter.com,2020-11-16T20:44:30.000Z,1,Twitter used to be wonderful till it…,Twitter used to be wonderful till it got into politics and started censoring. Their algorithms are horrible. Keep in mind they don't censor everyone just anyone who is for Trump. They interfered in our election more than Russia ever did! !,US
712,www.twitter.com,2020-11-15T23:38:06.000Z,1,"Fact Check this, Twitter!",I don't like Twitter moderating user's posts. Twitter prevents it's users from speaking freely.  Zero stars !,US
713,www.twitter.com,2020-11-15T18:12:28.000Z,1,They let Nazis’s grandchildren attack…,They let Nazis’s grandchildren attack people in their site.,US
714,www.twitter.com,2020-11-15T15:56:53.000Z,1,Twitter Is Unclaimed,"Date of experience:   November 15, 2020",US
715,www.twitter.com,2020-11-20T17:40:19.000Z,1,We are no longer silent,"We are no longer silent, we will never use twitter again we have a new social media platform. Trump 2020!!",US
716,www.twitter.com,2020-11-14T17:13:30.000Z,1,Horrible,Horrible.  You can be censored. Leaving for Parler.,US
717,www.twitter.com,2020-11-14T08:17:31.000Z,1,Sadly there political bias and meddling…,"Sadly there political bias and meddling in information to suit there narrative is not safe for our children's future , freedom of opinion is essential for us to keep evolving.  Paler is the new twitter.",GB
718,www.twitter.com,2020-11-14T01:04:10.000Z,1,If I could give 0 I would..,"If I could give 0, I would! Twitter has become an extremely unsafe, dangerous place for freedom of speech. It was fun but now it is extremely dangerous as it promotes fascism, communism and socialism. I have reported several accounts for their fascists comments (like the AOC Tweet calling people ''sociopaths'') but nothing happened. They Intentionally censor certain people while encouraging people that spread Racism, Fascism and Bully a certain group of people or discriminate against people based on their political views! Extremely Bias and Subjective Platform where people are attacked based on politics!",US
719,www.twitter.com,2020-11-13T21:08:03.000Z,1,Too much sensoring of info!,"Date of experience:   November 13, 2020",US
720,www.twitter.com,2020-11-12T19:53:32.000Z,4,Unreasonable.,"Another user had an issue with one of my posts, and instead of approaching me about it, she went through Twitter, who punished me for it. They should have a look at her Tweets and direct messages, and see that she didn't bother trying to resolve the issue in a reasonable manner. Then punish her for it. I'm not angry; just hopeful that if this kind of thing happens again, Twitter will have taken on board how this should be handled.",GB
721,www.twitter.com,2020-11-11T03:49:34.000Z,1,twitter sucks,"Date of experience:   November 11, 2020",US
722,www.twitter.com,2020-11-09T10:49:07.000Z,1,Censorship!,"Nothing done about spam bots, but a simple photo of a person using an army uniform is ""against the terms of service""! Shameful!",NL
723,www.twitter.com,2020-11-08T21:51:10.000Z,1,Heading to Parler,"Date of experience:   November 08, 2020",US
724,www.twitter.com,2020-11-08T21:00:12.000Z,1,Parler here I come.,"Parler here I come. Twitter part of a plot to destroy and humiliate the West. Only go there if you are a radical Terrorist , pedophile or a twisted lowlife pu**y. Brainwashing our children with extreme radical rhetoric , be warned parents.",GB
725,www.twitter.com,2020-11-08T19:08:17.000Z,1,Canceled,Welcome to the new economy,US
726,www.twitter.com,2020-11-08T02:25:11.000Z,1,I have been suspended for several…,"I have been suspended for several months for stating an opinion that twitter doesn't agree with , twitter can sensor our president so they most definitely can sensor all of us ... we must stand up to these communist and demand our political folks break up this group of in American companies.",US
727,www.twitter.com,2020-11-08T01:48:46.000Z,1,Twitter is run by a pile of muppets,"Twitter is run by a pile of muppets, My tweets and replys to other tweets kept getting notifications that I was not complying with their standards, today I deleted my account its full of trolls and really does encourage Hatred to wind everyone up, especially today lol wouldn't recommend Any site boycot the lot.",GB
728,www.twitter.com,2020-11-06T22:37:41.000Z,1,Anyone finds a way to post freely on…,Anyone finds a way to post freely on Twitter without being banned or labeled a certain way I'm all ears,US
729,www.twitter.com,2020-11-06T04:06:34.000Z,1,Huge lack of technology,"In this day of technology, Twitter should have the ability to actually READ the tickets being submitted for help. I have been trying to reset my password to my main account for years. I don't have access to the email address I used when I created the Twitter account, and I keep getting the same response to my request ""Hello,  The email address you used to reach out doesn’t match the email on the account you mentioned.  You can file a new request using the email address already associated with the account if the email on the first request was a mistake."" I already told them the emails didn't match. The fact that they don't have some method to reset the account when you lose access is kind of like being DOS in the Windows world.  I only want to close my account, and check every few months or every year, to see if they caught up with technology.  Nope! Not yet.  I'm glad I'm not an avid user.",US
730,www.twitter.com,2020-11-06T00:38:50.000Z,1,Biden  & Liberal loving freaks,"Biden  & Liberal loving freaks. Censors posts that don’t line up with their Democratic views, so disgusting. Having this app is equivalent to hanging around miserable, purple-haired teens swearing at the world and swearing at anything or anyone that asks for hard work.",US
731,www.twitter.com,2020-11-03T09:12:43.000Z,1,This is my second review of Twitter,"This is my second review of Twitter, and the service has deteriorated still further. Now, Twitter have resorted to petty, childish, behaviour. They are clearly a weak company, who cannot behave maturely, or deal with criticism. The company lacks the skills to reply to individuals, and will send the standard, cut and paste, 'sorry you feel that way' brush off.",GB
732,www.twitter.com,2020-11-02T17:31:03.000Z,1,Censorship and bias On an exponential…,Censorship and bias On an exponential level,GB
733,www.twitter.com,2020-11-02T14:43:15.000Z,1,Wish I could give a negative 5 star review,Wish I could give a negative 5 stars review. They are biased as hell and suspended an 11 year old account with 90k followers for no reason 2 weeks before election.  They refuse to give a reason or answer my emails. They won't even answer the BBB complaints.,US
734,www.twitter.com,2020-11-02T03:46:03.000Z,1,Twitter censors everybody that they do…,Twitter censors everybody that they do not agree with. 1st Amendment? No. Not with Twitter.,US
735,www.twitter.com,2020-11-01T14:28:07.000Z,1,KINDERGARTEN BOYS PLAY I.T.   Twitter applies it's rules unevenly,"Twitter applies its rules unevenly, unfairly, and capriciously.  It has only online support operated by kindergarten schoolboys.  It suspended one account, locked two others, never explained why, specifically, sent online suggestions with no relation to my problem, closed each case without ever addressing the problem, and, when I continued requesting help, reduced the app to a blank page.  No recourse. So many reviews over last 3 years day similar things.  So  support never improves its approach",US
736,www.twitter.com,2020-10-31T14:36:00.000Z,1,I have requested to twitter several…,I have requested to twitter several time for restoring my account  @rpsndey362  But have not received any reply from twitter team  User Name-Rupesh Pandey,IN
737,www.twitter.com,2020-10-31T03:29:08.000Z,1,Throbbing cock blister of far-left politics.,"In the same day that a 70-year old lady was decapitated, a man's throat slit and another woman stabbed to death inside a church in France, by an Islamic terrorist, ""Islamaphobia"" was instantly trending. This site cares more about people's feelings than people's lives.",GB
738,www.twitter.com,2020-10-30T10:59:16.000Z,1,Ban twitter not a fare Company,Ban twitter not a fare Company.  No freedom of speech.  Too far left.  Pushing to remove Section 230 then see what happens to them.  I deactivated my account will not use or promote them.  Twitter sucks.  If we all ban them they will only have left Dems left no news.,US
739,www.twitter.com,2020-10-29T19:57:40.000Z,1,Suspended my account for no reason,"Suspended my account for no reason, customer service wouldn't even reply. Yet they let Trump tweet racist bullying threats daily. I hate their double standards. Horrible service. #boycotttwitter",AU
740,www.twitter.com,2020-10-29T18:23:52.000Z,1,Twitter sucks,Twitter sucks. Haven't been there long. I been censored like everyday I get out of twitter jail. Free speech right to peacefully assemble. Unconstitutional. Blocking free speech is election meddling. Should be sued or shut down. Hope twitter falls off the earth and jack loses all his $$ from being sued. Facebook is better then Twitter and that sad.,US
741,www.twitter.com,2020-10-29T09:48:15.000Z,2,There are very few reasons for Twitter…,"There are very few reasons for Twitter to suspend the account, and the censorship process is slow.",IL
742,www.twitter.com,2020-10-28T22:40:22.000Z,1,I deleted the app after a Facebook…,"I deleted the app after a Facebook friend spoke of their censoring people.   I posted a comment saying "" No one will put up with bullying censorship "" .  THEY LOCKED MY ACCT.  I GUESS MY FRIEND WAS RIGHT.  BOTH OF US ARE CONSERVATIVES.",US
743,www.twitter.com,2020-10-28T11:40:40.000Z,1,"Anti-First Amendment, Anti-American","Twitter is one of the most anti-American platforms in existence. They suspended my account without providing any reasoning. I'm sure its simply because my views don't line up with theirs. We should be allowed to speak freely, unless threatening harm to others.",US
744,www.twitter.com,2020-10-27T22:49:00.000Z,1,I had been a user for many years....off to Parler!,"I had been a user for many years.  Used for sports, politics, religion, research, business, etc.  The hardcore left leaning bias/hatred is palpable, but I dealt with it.  But I just received an account suspension for totally innocuous reply to someone's tweet.  That was it, no need to appeal.....I'm moving to Parler where other feedback suggests they protect and encourage free speech.",US
745,www.twitter.com,2020-10-27T17:06:24.000Z,1,TWITter is for ....,"A video was sent using my account , of which the sentiment I totally agree with, i got suspended, and now I can’t even get rid of the account and if it gets unsuspended i still don’t want it or notifications from twitter , you get strangers following you for no reason which i find creepy and it’s really dead and extremely boring",GB
746,www.twitter.com,2020-10-27T04:14:27.000Z,1,If I could give them zero stars I would…,If I could give them zero stars I would you have no freedom of speech they shut your voice down for speaking the truth,US
